Title,Year,Rating,Length (minutes),Rating Amount,Group,Metascore,Short Description,Directors,Star 1,Star 2,Star 3
Doctor Sleep,2019,7.3,152,229000,R,59.0,"Years following the events of The Shining (1980), a now-adult Dan Torrance must protect a young girl with similar powers from a cult known as The True Knot, who prey on children with powers to remain immortal.",Mike Flanagan,Ewan McGregor, Rebecca Ferguson, Kyliegh Curran
The Lincoln Lawyer,2011,7.3,118,260000,R,63.0,"Defence lawyer Mick Haller lands a case defending a wealthy realtor's son who is accused of raping a prostitute. Believing his client to be innocent, Haller soon finds evidence that proves otherwise.",Brad Furman,Matthew McConaughey, Marisa Tomei, Ryan Phillippe
"Girl, Interrupted",1999,7.3,127,221000,R,51.0,"Directionless teenager Susanna is rushed to Claymoore, a mental institution, after a supposed suicide attempt. There she befriends a group of troubled women who deeply influence her life.",James Mangold,Winona Ryder, Angelina Jolie, Clea DuVall
Shot Caller,2017,7.3,121,106000,R,59.0,A newly released prisoner is forced by the leaders of his gang to orchestrate a major crime with a brutal rival gang on the streets of Southern California.,Ric Roman Waugh,Nikolaj Coster-Waldau, Omari Hardwick, Lake Bell
Flight,2012,7.3,138,384000,R,76.0,Troubling questions arise after airline pilot Whip Whitaker makes a miracle landing after a mid-air catastrophe.,Robert Zemeckis,Denzel Washington, Nadine Velazquez, Don Cheadle
El Camino,2019,7.3,122,309000,TV-MA,72.0,"Fugitive Jesse Pinkman runs from his captors, the law, and his past.",Vince Gilligan,Aaron Paul, Jonathan Banks, Matt Jones
Cruella,2021,7.3,134,277000,PG-13,59.0,"During the 1970s London punk rock revolution, young grifter Estella transforms herself into the raucous, revenge-bent Cruella de Vil.",Craig Gillespie,Emma Stone, Emma Thompson, Joel Fry
The Last Duel,2021,7.3,152,191000,R,67.0,The Knight Jean de Carrouges must settle the dispute over his wife Marguerite by challenging his former friend to a duel to the death.,Ridley Scott,Matt Damon, Adam Driver, Jodie Comer
"Are You There God? It's Me, Margaret.",2023,7.3,106,32000,PG-13,84.0,"Eleven-year-old Margaret moves from the city to the suburbs and starts to contemplate everything about life, friendship and adolescence. She relies on her mother, Barbara, who offers loving support, and her grandmother, Sylvia.",Kelly Fremon Craig,Abby Ryder Fortson, Rachel McAdams, Kathy Bates
Speed,1994,7.3,116,403000,R,78.0,A young police officer must prevent a bomb exploding aboard a city bus by keeping its speed above 50 mph.,Jan de Bont,Keanu Reeves, Dennis Hopper, Sandra Bullock
The Jungle Book,2016,7.3,106,297000,PG,77.0,"After a threat from the tiger Shere Khan forces him to flee the jungle, a man-cub named Mowgli embarks on a journey of self discovery with the help of panther Bagheera and free-spirited bear Baloo.",Jon Favreau,Neel Sethi, Bill Murray, Ben Kingsley
Vacation,1983,7.3,98,123000,R,55.0,The Griswold family's cross-country drive to the Walley World theme park proves to be much more arduous than they ever anticipated.,Harold Ramis,Chevy Chase, Beverly D'Angelo, Imogene Coca
Rocketman,2019,7.3,121,202000,R,69.0,"The musical fantasy about Elton John's breakthrough years, from his time as a prodigy at the Royal Academy of Music through his influential and enduring musical partnership with Bernie Taupin.",Dexter Fletcher,Taron Egerton, Jamie Bell, Richard Madden
Identity,2003,7.3,90,276000,R,64.0,"Stranded at a desolate Nevada motel during a nasty rain storm, ten strangers become acquainted with each other when they realize that they're being killed off one by one.",James Mangold,John Cusack, Ray Liotta, Amanda Peet
Gremlins,1984,7.3,106,259000,PG,70.0,A young man inadvertently breaks three important rules concerning his new pet and unleashes a horde of malevolently mischievous monsters on a small town.,Joe Dante,Zach Galligan, Phoebe Cates, Hoyt Axton
Poltergeist,1982,7.3,114,187000,PG,79.0,"A family's home becomes the center of paranormal activity that opens a doorway to the ""other side."" With help, they must cross over to get their daughter back.",Tobe Hooper,JoBeth Williams, Heather O'Rourke, Craig T. Nelson
Despicable Me 2,2013,7.3,98,439000,PG,62.0,"When a new criminal comes to town, the Anti-Villain League decides to hire Gru in order to fight him off. While Gru initially refuses, he eventually agrees after his aide goes back to his evil ways.","Pierre Coffin, Chris Renaud",Steve Carell, Kristen Wiig, Benjamin Bratt
Monster,2003,7.3,109,166000,R,74.0,"Based on the life of Aileen Wuornos, a Daytona Beach prostitute who became a serial killer.",Patty Jenkins,Charlize Theron, Christina Ricci, Bruce Dern
Carol,2015,7.3,118,147000,R,94.0,An aspiring photographer develops an intimate relationship with an older woman in 1950s New York.,Todd Haynes,Cate Blanchett, Rooney Mara, Sarah Paulson
Lilo & Stitch,2002,7.3,85,221000,PG,74.0,"A young and parentless girl adopts a 'dog' from the local pound, completely unaware that it's supposedly a dangerous scientific experiment that's taken refuge on Earth and is now hiding from its creator and those who see it as a menace.","Dean DeBlois, Chris Sanders",Daveigh Chase, Chris Sanders, Tia Carrere
True Lies,1994,7.3,141,289000,R,63.0,"A fearless, globe-trotting, terrorist-battling secret agent has his life turned upside down when he discovers his wife might be having an affair with a used-car salesman while terrorists smuggle nuclear war heads into the United States.",James Cameron,Arnold Schwarzenegger, Jamie Lee Curtis, Tom Arnold
Unbreakable,2000,7.3,106,453000,PG-13,62.0,A man learns something extraordinary about himself after a devastating accident.,M. Night Shyamalan,Bruce Willis, Samuel L. Jackson, Robin Wright
The Place Beyond the Pines,2012,7.3,140,297000,R,68.0,A stunt rider turns into a robber in order to lead a happy life with his child and lover and grabs the attention of a police officer. They both get on a collision course that affects their families.,Derek Cianfrance,Ryan Gosling, Bradley Cooper, Eva Mendes
Chef,2014,7.3,114,240000,R,68.0,"A head chef quits his restaurant job and buys a food truck in an effort to reclaim his creative promise, while piecing back together his estranged family.",Jon Favreau,Jon Favreau, Robert Downey Jr., Scarlett Johansson
Nomadland,2020,7.3,107,190000,R,87.0,"A woman in her sixties, after losing everything in the Great Recession, embarks on a journey through the American West, living as a van-dwelling modern-day nomad.",Chloé Zhao,Frances McDormand, David Strathairn, Linda May
Steel Magnolias,1989,7.3,117,65000,PG,56.0,"A young beautician, newly arrived in a small Louisiana town, finds work at the local salon, where a small group of women share a close bond of friendship, and welcome her into the fold.",Herbert Ross,Shirley MacLaine, Olympia Dukakis, Sally Field
Southpaw,2015,7.3,124,266000,R,57.0,"After a fatal incident sends him on a rampant path of destruction, a champion boxer fights to get custody of his daughter and revive his professional career.",Antoine Fuqua,Jake Gyllenhaal, Rachel McAdams, Oona Laurence
Death on the Nile,1978,7.3,140,42000,PG,59.0,"As Hercule Poirot enjoys a luxurious cruise down the Nile, a newlywed heiress is found murdered on board. Can Poirot identify the killer before the ship reaches the end of its journey?",John Guillermin,Peter Ustinov, Mia Farrow, Simon MacCorkindale
Sleepy Hollow,1999,7.3,105,396000,R,65.0,Ichabod Crane is sent to Sleepy Hollow to investigate the decapitations of three people; the culprit is legendary apparition The Headless Horseman.,Tim Burton,Johnny Depp, Christina Ricci, Miranda Richardson
Memoirs of a Geisha,2005,7.3,145,165000,PG-13,54.0,"The heartwarming tale of Nitta Sayuri, a young Japanese woman who transcended from her fishing-village roots and became one of Japan's most celebrated geisha.",Rob Marshall,Ziyi Zhang, Ken Watanabe, Michelle Yeoh
The Basketball Diaries,1995,7.3,102,125000,R,46.0,A teenager finds his dreams of becoming a basketball star threatened after he free falls into the harrowing world of drug addiction.,Scott Kalvert,Leonardo DiCaprio, Lorraine Bracco, Marilyn Sokol
Cape Fear,1991,7.3,128,224000,R,73.0,"A convicted rapist, released from prison after serving a fourteen-year sentence, stalks the family of the lawyer who originally defended him.",Martin Scorsese,Robert De Niro, Nick Nolte, Jessica Lange
Sexy Beast,2000,7.3,89,72000,R,79.0,"Brutal gangster Don Logan recruits ""retired"" safecracker Gal for one last job, but it goes badly for both of them.",Jonathan Glazer,Ray Winstone, Ben Kingsley, Ian McShane
Sweeney Todd: The Demon Barber of Fleet Street,2007,7.3,116,395000,R,83.0,"The legendary tale of a barber who returns from wrongful imprisonment to 1840s London, bent on revenge for the rape and death of his wife, and resumes his trade while forming a sinister partnership with his fellow tenant, Mrs. Lovett.",Tim Burton,Johnny Depp, Helena Bonham Carter, Alan Rickman
A League of Their Own,1992,7.3,128,124000,PG,69.0,"During World War II, sisters Dottie and Kit join the first female professional baseball league and struggle to help it succeed amid their own growing rivalry.",Penny Marshall,Tom Hanks, Geena Davis, Lori Petty
A Walk to Remember,2002,7.3,101,225000,PG,35.0,"Two North Carolina teens, Landon Carter and Jamie Sullivan, are thrown together after Landon gets into trouble and is sentenced to perform community service.",Adam Shankman,Mandy Moore, Shane West, Peter Coyote
Big,1988,7.3,104,248000,PG,73.0,"After wishing to be made big, a teenage boy wakes the next morning to find himself mysteriously in the body of an adult.",Penny Marshall,Tom Hanks, Elizabeth Perkins, Robert Loggia
Much Ado About Nothing,1993,7.3,111,53000,PG-13,80.0,"Young lovers, and soon to wed, Hero and Claudio conspire to get verbal sparring partners and confirmed singles, Benedick and Beatrice, to wed as well.",Kenneth Branagh,Kenneth Branagh, Emma Thompson, Keanu Reeves
The Adventures of Tintin,2011,7.3,107,248000,PG,68.0,Intrepid reporter Tintin and Captain Haddock set off on a treasure hunt for a sunken ship commanded by Haddock's ancestor.,Steven Spielberg,Jamie Bell, Andy Serkis, Daniel Craig
Fast Five,2011,7.3,130,417000,PG-13,66.0,Dominic Toretto and his crew of street racers plan a massive heist to buy their freedom while in the sights of a powerful Brazilian drug lord and a dangerous federal agent.,Justin Lin,Vin Diesel, Paul Walker, Dwayne Johnson
Equilibrium,2002,7.3,107,353000,R,33.0,"In an oppressive future where all forms of feeling are illegal, a man in charge of enforcing the law rises to overthrow the system and state.",Kurt Wimmer,Christian Bale, Sean Bean, Emily Watson
Bound,1996,7.3,109,63000,R,64.0,Tough ex-con Corky and her lover Violet concoct a scheme to steal millions of stashed mob money and pin the blame on Violet's crooked boyfriend Caesar.,"Lana Wachowski, Lilly Wachowski",Jennifer Tilly, Gina Gershon, Joe Pantoliano
Lincoln,2012,7.3,150,277000,PG-13,87.0,"As the Civil War rages on, U.S President Abraham Lincoln struggles with continuing carnage on the battlefield as he fights with many inside his own cabinet on his decision to emancipate the slaves.",Steven Spielberg,Daniel Day-Lewis, Sally Field, David Strathairn
Hustle,2022,7.3,117,152000,R,68.0,A basketball scout discovers a phenomenal street ball player while in Spain and sees the prospect as his opportunity to get back into the NBA.,Jeremiah Zagar,Adam Sandler, Queen Latifah, Juancho Hernangomez
Punch-Drunk Love,2002,7.3,95,183000,R,78.0,Socially frustrated Barry Egan calls a phone-sex line to curb his loneliness. Little does he know it will land him in deep trouble and will jeopardize his burgeoning romance with the mysterious Lena.,Paul Thomas Anderson,Adam Sandler, Emily Watson, Philip Seymour Hoffman
The Return of the Living Dead,1985,7.3,91,72000,R,66.0,"When two bumbling employees at a medical supply warehouse accidentally release a deadly gas into the air, the vapors cause the dead to rise again as zombies.",Dan O'Bannon,Clu Gulager, James Karen, Don Calfa
The Death of Stalin,2017,7.3,107,118000,R,88.0,"Moscow, 1953. After being in power for nearly 30 years, Soviet dictator, Joseph Vissarionovich Stalin, takes ill and quickly dies. Now the members of the Council of Ministers scramble for power.",Armando Iannucci,Steve Buscemi, Simon Russell Beale, Jeffrey Tambor
The Edge of Seventeen,2016,7.3,104,145000,R,77.0,"High-school life gets even more unbearable for Nadine when her best friend, Krista, starts dating her older brother.",Kelly Fremon Craig,Hailee Steinfeld, Haley Lu Richardson, Blake Jenner
Before the Devil Knows You're Dead,2007,7.3,117,115000,R,86.0,"When two brothers organize the robbery of their parents' jewelry store the job goes horribly wrong, triggering a series of events that sends them, their father and one brother's wife barreling towards a shattering climax.",Sidney Lumet,Philip Seymour Hoffman, Ethan Hawke, Albert Finney
The Nightingale,2018,7.3,136,38000,R,77.0,"Set in 1825, Clare, a young Irish convict woman, chases a British officer through the rugged Tasmanian wilderness, bent on revenge for a terrible act of violence he committed against her family. On the way she enlists the services of an Aboriginal tracker named Billy, who is also marked by trauma from his own violence-filled past.",Jennifer Kent,Aisling Franciosi, Maya Christie, Baykali Ganambarr
First Man,2018,7.3,141,208000,PG-13,84.0,"A look at the life of the astronaut, Neil Armstrong, and the legendary space mission that led him to become the first man to walk on the Moon on July 20, 1969.",Damien Chazelle,Ryan Gosling, Claire Foy, Jason Clarke
The Secret Garden,1993,7.3,101,46000,G,74.0,"A young, recently-orphaned girl is sent to England after living in India all of her life. Once there, she begins to explore her new, seemingly-isolated surroundings, and its secrets.",Agnieszka Holland,Kate Maberly, Maggie Smith, Heydon Prowse
From Russia with Love,1963,7.3,115,150000,PG,83.0,James Bond willingly falls into an assassination plot involving a naive Russian beauty in order to retrieve a Soviet encryption device that was stolen by the organization Spectre.,Terence Young,Sean Connery, Robert Shaw, Lotte Lenya
M*A*S*H,1970,7.3,116,80000,R,80.0,The staff of a Korean War field hospital uses humor and hijinks to keep their sanity in the face of the horror of war.,Robert Altman,Donald Sutherland, Elliott Gould, Tom Skerritt
Mr. Brooks,2007,7.3,120,160000,R,45.0,A well-respected businessman is sometimes controlled by his murder and mayhem-loving alter ego.,Bruce A. Evans,Kevin Costner, Demi Moore, William Hurt
Dogma,1999,7.3,130,233000,R,62.0,An abortion clinic worker with a special heritage is called upon to save the existence of humanity from being negated by two renegade angels trying to exploit a loop-hole and reenter Heaven.,Kevin Smith,Ben Affleck, Matt Damon, Linda Fiorentino
Pale Rider,1985,7.3,115,67000,R,61.0,A mysterious preacher protects a humble prospector village from a greedy mining company trying to encroach on their land.,Clint Eastwood,Clint Eastwood, Michael Moriarty, Carrie Snodgress
Raya and the Last Dragon,2021,7.3,107,178000,PG,74.0,"In a realm known as Kumandra, a re-imagined Earth inhabited by an ancient civilization, a warrior named Raya is determined to find the last dragon.","Don Hall, Carlos López Estrada, Paul Briggs",Kelly Marie Tran, Awkwafina, Gemma Chan
Suspiria,1977,7.3,92,111000,R,79.0,An American newcomer to a prestigious German ballet academy comes to realize that the school is a front for something sinister amid a series of grisly murders.,Dario Argento,Jessica Harper, Stefania Casini, Flavio Bucci
The Conjuring 2,2016,7.3,134,314000,R,65.0,Ed and Lorraine Warren travel to North London to help a single mother raising four children alone in a house plagued by a supernatural spirit.,James Wan,Vera Farmiga, Patrick Wilson, Madison Wolfe
Good Time,2017,7.3,102,145000,R,80.0,"After a botched bank robbery lands his younger brother in prison, Connie Nikas embarks on a twisted odyssey through New York City's underworld to get his brother Nick out of jail.","Benny Safdie, Josh Safdie",Robert Pattinson, Benny Safdie, Jennifer Jason Leigh
Tarzan,1999,7.3,88,256000,G,80.0,A man raised by gorillas must decide where he really belongs when he discovers he is a human.,"Chris Buck, Kevin Lima",Tony Goldwyn, Minnie Driver, Brian Blessed
Patriots Day,2016,7.3,133,117000,R,69.0,"The story of the 2013 Boston Marathon bombing and the aftermath, which includes the city-wide manhunt to find the terrorists responsible.",Peter Berg,Mark Wahlberg, Michelle Monaghan, J.K. Simmons
The Guernsey Literary and Potato Peel Pie Society,2018,7.3,124,55000,TV-14,65.0,"In the aftermath of World War II, a writer forms an unexpected bond with the residents of Guernsey Island when she decides to write a book about their experiences during the war. Then she learns the secret they are afraid to reveal.",Mike Newell,Jessica Brown Findlay, Tom Courtenay, Michiel Huisman
Little Women,1994,7.3,115,66000,PG,87.0,"Jo struggles for independence and sometimes clashes with her beloved mother and sisters Meg, Amy and Beth. She also contends with their cranky Aunt March, their impulsive neighbor Laurie and kindly linguistics professor Friedrich Bhaer.",Gillian Armstrong,Susan Sarandon, Winona Ryder, Kirsten Dunst
The Constant Gardener,2005,7.3,129,151000,R,82.0,A widower's transcontinental quest to find answers about his wife's death leads him to explosive secrets.,Fernando Meirelles,Ralph Fiennes, Rachel Weisz, Danny Huston
Coach Carter,2005,7.3,136,178000,PG-13,57.0,Controversy surrounds high school basketball coach Ken Carter after he benches his entire team for breaking their academic contract with him.,Thomas Carter,Samuel L. Jackson, Rick Gonzalez, Robert Ri'chard
The Next Three Days,2010,7.3,133,210000,PG-13,52.0,A married couple's life is turned upside down when the wife is accused of a murder.,Paul Haggis,Russell Crowe, Elizabeth Banks, Liam Neeson
Eighth Grade,2018,7.3,93,84000,R,85.0,An introverted teenage girl tries to survive the last week of her disastrous eighth grade year before leaving to start high school.,Bo Burnham,Elsie Fisher, Josh Hamilton, Emily Robinson
The Lego Batman Movie,2017,7.3,104,180000,PG,75.0,"A cooler-than-ever Bruce Wayne must deal with the usual suspects as they plan to rule Gotham City, while discovering that he has accidentally adopted a teenage orphan who wishes to become his sidekick.",Chris McKay,Will Arnett, Michael Cera, Rosario Dawson
Kung Fu Panda 2,2011,7.3,90,334000,PG,67.0,"Po and his friends fight to stop a peacock villain from conquering China with a deadly new weapon, but first the Dragon Warrior must come to terms with his past.",Jennifer Yuh Nelson,Jack Black, Angelina Jolie, Jackie Chan
Heavenly Creatures,1994,7.3,99,69000,R,86.0,"Two teenage girls share a unique bond: their parents, concerned that the friendship is too intense, separate them, and the girls take revenge.",Peter Jackson,Melanie Lynskey, Kate Winslet, Sarah Peirse
The Man in the Moon,1991,7.3,99,20000,PG-13,73.0,A coming of age story set in the south of the U.S. when Elvis was King.,Robert Mulligan,Sam Waterston, Tess Harper, Gail Strickland
Official Secrets,2019,7.3,112,57000,R,63.0,The true story of a British whistleblower who leaked information to the press about an illegal NSA spy operation designed to push the UN Security Council into sanctioning the 2003 invasion of Iraq.,Gavin Hood,Keira Knightley, Matt Smith, Matthew Goode
Youth,2015,7.3,124,85000,R,64.0,Retired orchestra conductor Fred Ballinger is on vacation with his daughter Lena and his film director best friend Mick Boyle in the Alps when he receives an invitation from Queen Elizabeth II to perform for Prince Philip's birthday.,Paolo Sorrentino,Michael Caine, Harvey Keitel, Rachel Weisz
Megamind,2010,7.3,95,306000,PG,63.0,"Evil genius Megamind finally defeats his do-gooder nemesis, Metro Man, but is left without a purpose in a superhero-free world.",Tom McGrath,Will Ferrell, Jonah Hill, Brad Pitt
Amistad,1997,7.3,155,85000,R,64.0,"In 1839, the revolt of Mende captives aboard a Spanish owned ship causes a major controversy in the United States when the ship is captured off the coast of Long Island. The courts must decide whether the Mende are slaves or legally free.",Steven Spielberg,Djimon Hounsou, Matthew McConaughey, Anthony Hopkins
BlackBerry,2023,7.3,120,54000,R,78.0,The story of the meteoric rise and catastrophic demise of the world's first smartphone.,Matt Johnson,Jay Baruchel, Glenn Howerton, Matt Johnson
Lars and the Real Girl,2007,7.3,106,160000,PG-13,70.0,A delusional young man strikes up an unconventional relationship with a doll he finds on the Internet.,Craig Gillespie,Ryan Gosling, Emily Mortimer, Paul Schneider
She Said,2022,7.3,129,45000,R,74.0,Jodi Kantor and Megan Twohey's quest to break the Harvey Weinstein scandal.,Maria Schrader,Zoe Kazan, Carey Mulligan, Patricia Clarkson
My Sister's Keeper,2009,7.3,109,100000,PG-13,51.0,Anna Fitzgerald looks to earn medical emancipation from her parents who until now have relied on their youngest child to help their leukemia-stricken daughter Kate remain alive.,Nick Cassavetes,Cameron Diaz, Abigail Breslin, Alec Baldwin
Wall Street,1987,7.3,126,168000,R,56.0,"An impatient young stockbroker is willing to do anything to get to the top, including trading on illegal inside information taken through a ruthless, greedy corporate raider who takes the youth under his wing.",Oliver Stone,Charlie Sheen, Michael Douglas, Tamara Tunie
Lucky,2017,7.3,88,27000,Not Rated,80.0,Lucky follows the spiritual journey of a 90-year-old atheist and the quirky characters that inhabit his off the map desert town.,John Carroll Lynch,Harry Dean Stanton, David Lynch, Ron Livingston
Instant Family,2018,7.3,118,126000,PG-13,57.0,A couple find themselves in over their heads when they foster three children.,Sean Anders,Mark Wahlberg, Rose Byrne, Isabela Merced
Rango,2011,7.3,107,302000,PG,75.0,"Rango is an ordinary chameleon who accidentally winds up in the town of Dirt, a lawless outpost in the Wild West in desperate need of a new sheriff.",Gore Verbinski,Johnny Depp, Isla Fisher, Timothy Olyphant
Rounders,1998,7.3,121,163000,R,53.0,"A young, reformed gambler must return to playing high stakes poker to help a friend pay off loan sharks, while balancing his relationship with his girlfriend and his commitments to law school.",John Dahl,Matt Damon, Edward Norton, Gretchen Mol
Say Anything,1989,7.3,100,98000,PG-13,86.0,A noble underachiever and a beautiful valedictorian fall in love the summer before she goes off to college.,Cameron Crowe,John Cusack, Ione Skye, John Mahoney
Death at a Funeral,2007,7.3,90,124000,R,67.0,Chaos ensues when a man tries to expose a dark secret regarding a recently deceased patriarch of a dysfunctional British family.,Frank Oz,Matthew Macfadyen, Peter Dinklage, Ewen Bremner
Jane Eyre,2011,7.3,120,95000,PG-13,76.0,A mousy governess who softens the heart of her employer soon discovers that he's hiding a terrible secret.,Cary Joji Fukunaga,Mia Wasikowska, Michael Fassbender, Jamie Bell
Raising Arizona,1987,7.3,94,155000,PG-13,69.0,"When a childless couple--an ex-con and an ex-cop--decide to help themselves to one of another family's quintuplets, their lives become more complicated than they anticipated.","Joel Coen, Ethan Coen",Nicolas Cage, Holly Hunter, Trey Wilson
Lethal Weapon 2,1989,7.3,114,194000,R,70.0,Riggs and Murtaugh are on the trail of South African diplomats who are using their immunity to engage in criminal activities.,Richard Donner,Mel Gibson, Danny Glover, Joe Pesci
Snowden,2016,7.3,134,167000,R,58.0,"The NSA's illegal surveillance techniques are leaked to the public by one of the agency's employees, Edward Snowden, in the form of thousands of classified documents distributed to the press.",Oliver Stone,Joseph Gordon-Levitt, Shailene Woodley, Melissa Leo
Pusher,1996,7.3,110,47000,Not Rated,72.0,A drug pusher grows increasingly desperate after a botched deal leaves him with a large debt to a ruthless drug lord.,Nicolas Winding Refn,Kim Bodnia, Zlatko Buric, Laura Drasbæk
The Descendants,2011,7.3,115,255000,R,84.0,A land baron tries to reconnect with his two daughters after his wife is seriously injured in a boating accident.,Alexander Payne,George Clooney, Shailene Woodley, Amara Miller
The Way,2010,7.3,123,36000,PG-13,64.0,"A father heads overseas to recover the body of his estranged son who died while traveling the ""El camino de Santiago,"" and decides to take the pilgrimage himself.",Emilio Estevez,Martin Sheen, Emilio Estevez, Deborah Kara Unger
Alice in Wonderland,1951,7.3,75,159000,Approved,68.0,Alice stumbles into the world of Wonderland. Will she get home? Not if the Queen of Hearts has her way.,"Clyde Geronimi, Wilfred Jackson, Hamilton Luske",Kathryn Beaumont, Ed Wynn, Richard Haydn
Enemy of the State,1998,7.3,132,265000,R,67.0,A lawyer becomes targeted by a corrupt politician and his N.S.A. goons when he accidentally receives key evidence to a politically motivated crime.,Tony Scott,Will Smith, Gene Hackman, Jon Voight
The Disaster Artist,2017,7.3,104,167000,R,76.0,"When aspiring actor Greg Sestero meets the weird and mysterious Tommy Wiseau in an acting class, they form a unique friendship and travel to Hollywood to make their dreams come true.",James Franco,James Franco, Dave Franco, Ari Graynor
Cinderella,1950,7.3,74,179000,G,85.0,"When Cinderella's cruel stepmother prevents her from attending the Royal Ball, she gets some unexpected help from the lovable mice Gus and Jaq and from her Fairy Godmother.","Clyde Geronimi, Wilfred Jackson, Hamilton Luske",Ilene Woods, James MacDonald, Eleanor Audley
