Title,Year,Rating,Length (minutes),Rating Amount,Group,Metascore,Short Description,Directors,Star 1,Star 2,Star 3
The Shawshank Redemption,1994,9.3,142,3000000,R,82.0,"A banker convicted of uxoricide forms a friendship over a quarter century with a hardened convict, while maintaining his innocence and trying to remain hopeful through simple compassion.",Frank Darabont,Tim Robbins, Morgan Freeman, Bob Gunton
The Godfather,1972,9.2,175,2100000,R,100.0,The aging patriarch of an organized crime dynasty transfers control of his clandestine empire to his reluctant son.,Francis Ford Coppola,Marlon Brando, Al Pacino, James Caan
The Dark Knight,2008,9.0,152,3000000,PG-13,84.0,"When a menace known as the Joker wreaks havoc and chaos on the people of Gotham, Batman, James Gordon and Harvey Dent must work together to put an end to the madness.",Christopher Nolan,Christian Bale, Heath Ledger, Aaron Eckhart
Schindler's List,1993,9.0,195,1500000,R,95.0,"In German-occupied Poland during World War II, industrialist Oskar Schindler gradually becomes concerned for his Jewish workforce after witnessing their persecution by the Nazis.",Steven Spielberg,Liam Neeson, Ralph Fiennes, Ben Kingsley
The Lord of the Rings: The Return of the King,2003,9.0,201,2100000,PG-13,94.0,Gandalf and Aragorn lead the World of Men against Sauron's army to draw his gaze from Frodo and Sam as they approach Mount Doom with the One Ring.,Peter Jackson,Elijah Wood, Viggo Mortensen, Ian McKellen
12 Angry Men,1957,9.0,96,907000,Approved,97.0,The jury in a New York City murder trial is frustrated by a single member whose skeptical caution forces them to more carefully consider the evidence before jumping to a hasty verdict.,Sidney Lumet,Henry Fonda, Lee J. Cobb, Martin Balsam
The Godfather Part II,1974,9.0,202,1400000,R,90.0,"The early life and career of Vito Corleone in 1920s New York City is portrayed, while his son, Michael, expands and tightens his grip on the family crime syndicate.",Francis Ford Coppola,Al Pacino, Robert De Niro, Robert Duvall
I'm Still Here,2024,8.9,136,13000,PG-13,85.0,A woman married to a former politician during the military dictatorship in Brazil is forced to chart a new path for herself and her children after her family's life is impacted by a violent and arbitrary act.,Walter Salles,Fernanda Torres, Fernanda Montenegro, Selton Mello
The Lord of the Rings: The Fellowship of the Ring,2001,8.9,178,2100000,PG-13,92.0,A meek Hobbit from the Shire and eight companions set out on a journey to destroy the powerful One Ring and save Middle-earth from the Dark Lord Sauron.,Peter Jackson,Elijah Wood, Ian McKellen, Orlando Bloom
Pulp Fiction,1994,8.9,154,2300000,R,95.0,"The lives of two mob hitmen, a boxer, a gangster and his wife, and a pair of diner bandits intertwine in four tales of violence and redemption.",Quentin Tarantino,John Travolta, Uma Thurman, Samuel L. Jackson
Inception,2010,8.8,148,2600000,PG-13,74.0,"A thief who steals corporate secrets through the use of dream-sharing technology is given the inverse task of planting an idea into the mind of a C.E.O., but his tragic past may doom the project and his team to disaster.",Christopher Nolan,Leonardo DiCaprio, Joseph Gordon-Levitt, Elliot Page
Fight Club,1999,8.8,139,2400000,R,67.0,An insomniac office worker and a devil-may-care soap maker form an underground fight club that evolves into much more.,David Fincher,Brad Pitt, Edward Norton, Meat Loaf
Forrest Gump,1994,8.8,142,2300000,PG-13,82.0,"The history of the United States from the 1950s to the '70s unfolds from the perspective of an Alabama man with an IQ of 75, who yearns to be reunited with his childhood sweetheart.",Robert Zemeckis,Tom Hanks, Robin Wright, Gary Sinise
The Lord of the Rings: The Two Towers,2002,8.8,179,1800000,PG-13,87.0,"While Frodo and Sam edge closer to Mordor with the help of the shifty Gollum, the divided fellowship makes a stand against Sauron's new ally, Saruman, and his hordes of Isengard.",Peter Jackson,Elijah Wood, Ian McKellen, Viggo Mortensen
"The Good, the Bad and the Ugly",1966,8.8,178,841000,R,90.0,A bounty-hunting scam joins two men in an uneasy alliance against a third in a race to find a fortune in gold buried in a remote cemetery.,Sergio Leone,Clint Eastwood, Eli Wallach, Lee Van Cleef
Interstellar,2014,8.7,169,2300000,PG-13,74.0,"When Earth becomes uninhabitable in the future, a farmer and ex-NASA pilot, Joseph Cooper, is tasked to pilot a spacecraft, along with a team of researchers, to find a new planet for humans.",Christopher Nolan,Matthew McConaughey, Anne Hathaway, Jessica Chastain
The Matrix,1999,8.7,136,2100000,R,73.0,"When a beautiful stranger leads computer hacker Neo to a forbidding underworld, he discovers the shocking truth--the life he knows is the elaborate deception of an evil cyber-intelligence.","Lana Wachowski, Lilly Wachowski",Keanu Reeves, Laurence Fishburne, Carrie-Anne Moss
Goodfellas,1990,8.7,145,1300000,R,92.0,"The story of Henry Hill and his life in the mafia, covering his relationship with his wife Karen and his mob partners Jimmy Conway and Tommy DeVito.",Martin Scorsese,Robert De Niro, Ray Liotta, Joe Pesci
One Flew Over the Cuckoo's Nest,1975,8.7,133,1100000,R,84.0,"In the Fall of 1963, a Korean War veteran and criminal pleads insanity and is admitted to a mental institution, where he rallies up the scared patients against the tyrannical nurse.",Milos Forman,Jack Nicholson, Louise Fletcher, Michael Berryman
Star Wars: Episode V - The Empire Strikes Back,1980,8.7,124,1400000,PG,82.0,"After the Empire overpowers the Rebel Alliance, Luke Skywalker begins his Jedi training with Yoda. At the same time, Darth Vader and bounty hunter Boba Fett pursue his friends across the galaxy.",Irvin Kershner,Mark Hamill, Harrison Ford, Carrie Fisher
Stop Making Sense,1984,8.7,88,22000,PG,94.0,A live performance of the band Talking Heads shot over the course of three nights at Hollywood's Pantages Theater in December of 1983 and featuring their most memorable songs.,Jonathan Demme,David Byrne, Bernie Worrell, Alex Weir
Shoah,1985,8.7,566,11000,Not Rated,99.0,Claude Lanzmann's epic documentary recounts the story of the Holocaust through interviews with witnesses - perpetrators as well as survivors.,Claude Lanzmann,Simon Srebnik, Michael Podchlebnik, Motke Zaïdl
Se7en,1995,8.6,127,1900000,R,65.0,"Two detectives, a rookie and a veteran, hunt a serial killer who uses the seven deadly sins as his motives.",David Fincher,Morgan Freeman, Brad Pitt, Kevin Spacey
Saving Private Ryan,1998,8.6,169,1500000,R,91.0,"Following the Normandy Landings, a group of U.S. soldiers go behind enemy lines to retrieve a paratrooper whose brothers have been killed in action.",Steven Spielberg,Tom Hanks, Matt Damon, Tom Sizemore
The Silence of the Lambs,1991,8.6,118,1600000,R,86.0,"A young F.B.I. cadet must receive the help of an incarcerated and manipulative cannibal killer to help catch another serial killer, a madman who skins his victims.",Jonathan Demme,Jodie Foster, Anthony Hopkins, Scott Glenn
The Green Mile,1999,8.6,189,1500000,R,61.0,"Paul Edgecomb, the head death row guard at a prison in 1930s Louisiana, meets an inmate, John Coffey, a black man who is accused of murdering two girls. His life changes drastically when he discovers that John has a special gift.",Frank Darabont,Tom Hanks, Michael Clarke Duncan, David Morse
Star Wars: Episode IV - A New Hope,1977,8.6,121,1500000,PG,90.0,"Luke Skywalker joins forces with a Jedi Knight, a cocky pilot, a Wookiee and two droids to save the galaxy from the Empire's world-destroying battle station, while also attempting to rescue Princess Leia from the mysterious Darth Vader.",George Lucas,Mark Hamill, Harrison Ford, Carrie Fisher
City of God,2002,8.6,130,827000,R,79.0,"In the slums of Rio, two kids' paths diverge as one struggles to become a photographer and the other a kingpin.","Fernando Meirelles, Kátia Lund",Alexandre Rodrigues, Leandro Firmino, Matheus Nachtergaele
Terminator 2: Judgment Day,1991,8.6,137,1200000,R,75.0,"A cyborg, identical to the one who failed to kill Sarah Connor, must now protect her ten year old son John from an even more advanced and powerful cyborg.",James Cameron,Arnold Schwarzenegger, Linda Hamilton, Edward Furlong
Spirited Away,2001,8.6,124,892000,PG,96.0,"During her family's move to the suburbs, a sullen 10-year-old girl wanders into a world ruled by gods, witches and spirits, and where humans are changed into beasts.",Hayao Miyazaki,Daveigh Chase, Suzanne Pleshette, Miyu Irino
Life Is Beautiful,1997,8.6,116,767000,PG-13,58.0,"When an open-minded Jewish waiter and his son become victims of the Holocaust, he uses a perfect mixture of will, humor and imagination to protect his son from the dangers around their camp.",Roberto Benigni,Roberto Benigni, Nicoletta Braschi, Giorgio Cantarini
It's a Wonderful Life,1946,8.6,130,522000,PG,89.0,An angel is sent from Heaven to help a desperately frustrated businessman by showing him what life would have been like if he had never existed.,Frank Capra,James Stewart, Donna Reed, Lionel Barrymore
Seven Samurai,1954,8.6,207,379000,Not Rated,98.0,"Farmers from a village exploited by bandits hire a veteran samurai for protection, and he gathers six other samurai to join him.",Akira Kurosawa,Toshirô Mifune, Takashi Shimura, Keiko Tsushima
Harakiri,1962,8.6,133,77000,Not Rated,85.0,"When a ronin requesting seppuku at a feudal lord's palace is told of the brutal suicide of another ronin who previously visited, he reveals how their pasts are intertwined - and in doing so challenges the clan's integrity.",Masaki Kobayashi,Tatsuya Nakadai, Akira Ishihama, Shima Iwashita
Gladiator,2000,8.5,155,1700000,R,67.0,A former Roman General sets out to exact vengeance against the corrupt emperor who murdered his family and sent him into slavery.,Ridley Scott,Russell Crowe, Joaquin Phoenix, Connie Nielsen
Dune: Part Two,2024,8.5,166,586000,PG-13,79.0,"Paul Atreides unites with the Fremen while on a warpath of revenge against the conspirators who destroyed his family. Facing a choice between the love of his life and the fate of the universe, he endeavors to prevent a terrible future.",Denis Villeneuve,Timothée Chalamet, Zendaya, Rebecca Ferguson
Parasite,2019,8.5,132,1000000,R,97.0,Greed and class discrimination threaten the newly formed symbiotic relationship between the wealthy Park family and the destitute Kim clan.,Bong Joon Ho,Song Kang-ho, Lee Sun-kyun, Cho Yeo-jeong
Alien,1979,8.5,117,1000000,R,89.0,"After investigating a mysterious transmission of unknown origin, the crew of a commercial spacecraft encounters a deadly lifeform.",Ridley Scott,Sigourney Weaver, Tom Skerritt, John Hurt
The Prestige,2006,8.5,130,1500000,PG-13,66.0,Rival 19th-century magicians engage in a bitter battle for trade secrets.,Christopher Nolan,Christian Bale, Hugh Jackman, Scarlett Johansson
The Departed,2006,8.5,151,1500000,R,85.0,An undercover cop and a mole in the police attempt to identify each other while infiltrating an Irish gang in South Boston.,Martin Scorsese,Leonardo DiCaprio, Matt Damon, Jack Nicholson
The Lion King,1994,8.5,88,1200000,G,88.0,"Lion prince Simba and his father are targeted by his bitter uncle, who wants to ascend the throne himself.","Roger Allers, Rob Minkoff",Matthew Broderick, Jeremy Irons, James Earl Jones
Léon: The Professional,1994,8.5,110,1300000,R,64.0,"12-year-old Mathilda is reluctantly taken in by Léon, a professional assassin, after her family is murdered. An unusual relationship forms as she becomes his protégée and learns the assassin's trade.",Luc Besson,Jean Reno, Gary Oldman, Natalie Portman
Whiplash,2014,8.5,106,1000000,R,89.0,A promising young drummer enrolls at a cut-throat music conservatory where his dreams of greatness are mentored by an instructor who will stop at nothing to realize a student's potential.,Damien Chazelle,Miles Teller, J.K. Simmons, Melissa Benoist
The Usual Suspects,1995,8.5,106,1200000,R,76.0,The sole survivor of a pier shoot-out tells the story of how a notorious criminal influenced the events that began with five criminals meeting in a seemingly random police lineup.,Bryan Singer,Kevin Spacey, Gabriel Byrne, Chazz Palminteri
Django Unchained,2012,8.5,165,1800000,R,81.0,"With the help of a German bounty-hunter, a freed slave sets out to rescue his wife from a brutal plantation owner in Mississippi.",Quentin Tarantino,Jamie Foxx, Christoph Waltz, Leonardo DiCaprio
Back to the Future,1985,8.5,116,1400000,PG,87.0,"Marty McFly, a 17-year-old high school student, is accidentally sent 30 years into the past in a time-traveling DeLorean invented by his close friend, the maverick scientist Doc Brown.",Robert Zemeckis,Michael J. Fox, Christopher Lloyd, Lea Thompson
Spider-Man: Across the Spider-Verse,2023,8.5,140,432000,PG,86.0,"Miles Morales catapults across the multiverse, where he encounters a team of Spider-People charged with protecting its very existence. When the heroes clash on how to handle a new threat, Miles must redefine what it means to be a hero.","Joaquim Dos Santos, Kemp Powers, Justin K. Thompson",Shameik Moore, Hailee Steinfeld, Brian Tyree Henry
The Pianist,2002,8.5,150,952000,R,85.0,"During WWII, acclaimed Polish musician Wladyslaw faces various struggles as he loses contact with his family. As the situation worsens, he hides in the ruins of Warsaw in order to survive.",Roman Polanski,Adrien Brody, Thomas Kretschmann, Frank Finlay
American History X,1998,8.5,119,1200000,R,62.0,"Living a life marked by violence, neo-Nazi Derek finally goes to prison after killing two black youths. Upon his release, Derek vows to change; he hopes to prevent his brother, Danny, who idolizes Derek, from following in his footsteps.",Tony Kaye,Edward Norton, Edward Furlong, Beverly D'Angelo
Once Upon a Time in the West,1968,8.5,166,363000,PG-13,82.0,A mysterious stranger with a harmonica joins forces with a notorious desperado to protect a beautiful widow from a ruthless assassin working for the railroad.,Sergio Leone,Henry Fonda, Charles Bronson, Claudia Cardinale
Grave of the Fireflies,1988,8.5,88,337000,Not Rated,94.0,A young boy and his little sister struggle to survive in Japan during World War II.,Isao Takahata,Tsutomu Tatsumi, Ayano Shiraishi, Akemi Yamaguchi
Casablanca,1942,8.5,102,624000,PG,100.0,A cynical expatriate American cafe owner struggles to decide whether or not to help his former lover and her fugitive husband escape the Nazis in French Morocco.,Michael Curtiz,Humphrey Bogart, Ingrid Bergman, Paul Henreid
The Intouchables,2011,8.5,112,964000,R,57.0,"After he becomes a quadriplegic from a paragliding accident, an aristocrat hires a young man from the projects to be his caregiver.","Olivier Nakache, Éric Toledano",François Cluzet, Omar Sy, Anne Le Ny
Psycho,1960,8.5,109,743000,R,97.0,A secretary on the run for embezzlement takes refuge at a secluded California motel owned by a repressed man and his overbearing mother.,Alfred Hitchcock,Anthony Perkins, Janet Leigh, Vera Miles
Cinema Paradiso,1988,8.5,174,296000,PG,80.0,"Salvatore, a famous film director, returns to his hometown for the funeral of the local theater's film projectionist, Alfredo. He reminisces about his life as a young boy falling in love with cinema.",Giuseppe Tornatore,Philippe Noiret, Enzo Cannavale, Antonella Attili
Rear Window,1954,8.5,112,540000,PG,100.0,A bored photographer recovering from a broken leg passes the time by watching his neighbors and begins to suspect one of them of murder.,Alfred Hitchcock,James Stewart, Grace Kelly, Wendell Corey
Dear Zachary: A Letter to a Son About His Father,2008,8.5,95,42000,Not Rated,82.0,A filmmaker decides to memorialize a murdered friend when his friend's ex-girlfriend announces she is expecting his son.,Kurt Kuenne,Kurt Kuenne, Andrew Bagby, David Bagby
Modern Times,1936,8.5,87,269000,G,96.0,The Tramp struggles to live in modern industrial society with the help of a young homeless woman.,Charles Chaplin,Charles Chaplin, Paulette Goddard, Henry Bergman
City Lights,1931,8.5,87,204000,G,99.0,"With the aid of a wealthy erratic tippler, a dewy-eyed tramp who has fallen in love with a sightless flower girl accumulates money to be able to help her medically.",Charles Chaplin,Charles Chaplin, Virginia Cherrill, Florence Lee
Senna,2010,8.5,106,80000,PG-13,79.0,"A documentary on Brazilian Formula One racing driver Ayrton Senna, who won the F1 world championship three times before his death at age 34.",Asif Kapadia,Ayrton Senna, Reginaldo Leme, John Bisignano
20 Days in Mariupol,2023,8.5,95,24000,TV-PG,83.0,"As the Russian invasion begins, a team of Ukrainian journalists trapped in the besieged city of Mariupol struggle to continue their work documenting the war's atrocities.",Mstyslav Chernov,Liudmyla Amelkina, Mstyslav Chernov, Roman Golovanov
The Best of Youth,2003,8.5,374,25000,R,89.0,An Italian epic that follows the lives of two brothers from the 1960s to the 2000s.,Marco Tullio Giordana,Luigi Lo Cascio, Alessio Boni, Jasmine Trinca
For Sama,2019,8.5,100,13000,TV-PG,89.0,FOR SAMA is both an intimate and epic journey into the female experience of war.,"Waad Al-Kateab, Edward Watts",Waad Al-Kateab, Sama Al-Khateab, Hamza Al-Khateab
Home,2009,8.5,118,23000,Not Rated,47.0,"With aerial footage from fifty-four countries, 'Home' is a depiction of how Earth's problems are all interlinked.",Yann Arthus-Bertrand,Yann Arthus-Bertrand, Glenn Close, Jacques Gamblin
Inglourious Basterds,2009,8.4,153,1700000,R,69.0,"In Nazi-occupied France during World War II, a plan to assassinate Nazi leaders by a group of Jewish U.S. soldiers coincides with a theatre owner's vengeful plans for the same.",Quentin Tarantino,Brad Pitt, Diane Kruger, Eli Roth
Avengers: Endgame,2019,8.4,181,1300000,PG-13,78.0,"After the devastating events of Avengers: Infinity War (2018), the universe is in ruins. With the help of remaining allies, the Avengers assemble once more in order to reverse Thanos' actions and restore balance to the universe.","Anthony Russo, Joe Russo",Robert Downey Jr., Chris Evans, Mark Ruffalo
Memento,2000,8.4,113,1400000,R,83.0,"Leonard Shelby, an insurance investigator, suffers from anterograde amnesia and uses notes and tattoos to hunt for the man he thinks killed his wife, which is the last thing he remembers.",Christopher Nolan,Guy Pearce, Carrie-Anne Moss, Joe Pantoliano
Apocalypse Now,1979,8.4,147,733000,R,94.0,A U.S. Army officer serving in Vietnam is tasked with assassinating a renegade Special Forces Colonel who sees himself as a god.,Francis Ford Coppola,Martin Sheen, Marlon Brando, Robert Duvall
Raiders of the Lost Ark,1981,8.4,115,1100000,PG,86.0,"In 1936, archaeologists and adventurers of the U.S. government hired Indiana Jones to find the Ark of the Covenant before the Nazis could obtain its extraordinary powers.",Steven Spielberg,Harrison Ford, Karen Allen, Paul Freeman
The Dark Knight Rises,2012,8.4,164,1900000,PG-13,78.0,"Bane, an imposing terrorist, attacks Gotham City and disrupts its eight-year-long period of peace. This forces Bruce Wayne to come out of hiding and don the cape and cowl of Batman again.",Christopher Nolan,Christian Bale, Tom Hardy, Anne Hathaway
Aliens,1986,8.4,137,800000,R,84.0,"Decades after surviving the Nostromo incident, Ellen Ripley is sent out to re-establish contact with a terraforming colony but finds herself battling the Alien Queen and her offspring.",James Cameron,Sigourney Weaver, Michael Biehn, Carrie Henn
The Shining,1980,8.4,146,1200000,R,68.0,"A family heads to an isolated hotel for the winter, where a sinister presence influences the father into violence. At the same time, his psychic son sees horrifying forebodings from both the past and the future.",Stanley Kubrick,Jack Nicholson, Shelley Duvall, Danny Lloyd
Avengers: Infinity War,2018,8.4,149,1300000,PG-13,68.0,The Avengers and their allies must be willing to sacrifice all in an attempt to defeat the powerful Thanos before his blitz of devastation and ruin puts an end to the universe.,"Anthony Russo, Joe Russo",Robert Downey Jr., Chris Hemsworth, Mark Ruffalo
Spider-Man: Into the Spider-Verse,2018,8.4,117,713000,PG,87.0,Teen Miles Morales becomes the Spider-Man of his universe and must join with five spider-powered individuals from other dimensions to stop a threat for all realities.,"Bob Persichetti, Peter Ramsey, Rodney Rothman",Shameik Moore, Jake Johnson, Hailee Steinfeld
Amadeus,1984,8.4,160,443000,PG,87.0,"The life, success and troubles of Wolfgang Amadeus Mozart, as told by Antonio Salieri, the contemporaneous composer who was deeply jealous of Mozart's talent and claimed to have murdered him.",Milos Forman,F. Murray Abraham, Tom Hulce, Elizabeth Berridge
The Lives of Others,2006,8.4,137,423000,R,89.0,"In 1984 East Berlin, an agent of the secret police conducting surveillance on a writer and his lover finds himself becoming increasingly absorbed by their lives.",Florian Henckel von Donnersmarck,Ulrich Mühe, Martina Gedeck, Sebastian Koch
Coco,2017,8.4,105,634000,PG,81.0,"Aspiring musician Miguel, confronted with his family's ancestral ban on music, enters the Land of the Dead to find his great-great-grandfather, a legendary singer.","Lee Unkrich, Adrian Molina",Anthony Gonzalez, Gael García Bernal, Benjamin Bratt
WALL·E,2008,8.4,98,1200000,G,95.0,"A robot who is responsible for cleaning a waste-covered Earth meets another robot and falls in love with her. Together, they set out on a journey that will alter the fate of mankind.",Andrew Stanton,Ben Burtt, Elissa Knight, Jeff Garlin
3 Idiots,2009,8.4,170,452000,PG-13,67.0,"Two friends are searching for their long lost companion. They revisit their college days and recall the memories of their friend who inspired them to think differently, even as the rest of the world called them ""idiots"".",Rajkumar Hirani,Aamir Khan, Madhavan, Mona Singh
Sunset Boulevard,1950,8.4,110,246000,Approved,94.0,A screenwriter develops a dangerous relationship with a faded film star determined to make a triumphant return.,Billy Wilder,William Holden, Gloria Swanson, Erich von Stroheim
Capernaum,2018,8.4,126,113000,R,75.0,"While serving a five-year sentence for a violent crime, a 12-year-old boy sues his parents for neglect.",Nadine Labaki,Zain Al Rafeea, Yordanos Shiferaw, Boluwatife Treasure Bankole
Witness for the Prosecution,1957,8.4,116,147000,Approved,76.0,A veteran British barrister must defend his client in a murder trial that has surprise after surprise.,Billy Wilder,Tyrone Power, Marlene Dietrich, Charles Laughton
Paths of Glory,1957,8.4,88,223000,Approved,90.0,A colonel defends three of his soldiers in a court-martial after they abandon a suicidal attack.,Stanley Kubrick,Kirk Douglas, Ralph Meeker, Adolphe Menjou
High and Low,1963,8.4,143,58000,Not Rated,90.0,An executive of a Yokohama shoe company becomes a victim of extortion when his chauffeur's son is kidnapped by mistake and held for ransom.,Akira Kurosawa,Toshirô Mifune, Yutaka Sada, Tatsuya Nakadai
Samsara,2011,8.4,102,39000,PG-13,65.0,"Filmed over nearly five years in twenty-five countries on five continents, and shot on seventy-millimetre film, Samsara transports us to the varied worlds of sacred grounds, disaster zones, industrial complexes, and natural wonders.",Ron Fricke,Balinese Tari Legong Dancers, Ni Made Megahadi Pratiwi, Puti Sri Candra Dewi
The Salt of the Earth,2014,8.4,110,24000,PG-13,83.0,"The life and work of photographer Sebastião Salgado, who has spent forty years documenting societies in hidden corners of the world.","Juliano Ribeiro Salgado, Wim Wenders",Sebastião Salgado, Wim Wenders, Lélia Wanick Salgado
The Cove,2009,8.4,92,52000,PG-13,84.0,"Using state-of-the-art equipment, a group of activists, led by renowned dolphin trainer Ric O'Barry, infiltrate a cove near Taijii, Japan to expose both a shocking instance of animal abuse and a serious threat to human health.",Louie Psihoyos,Richard O'Barry, Louie Psihoyos, Hardy Jones
Sansho the Bailiff,1954,8.4,124,19000,Not Rated,96.0,"In medieval Japan, a compassionate governor is sent into exile. His wife and children try to join him, but are separated, and the children grow up amid suffering and oppression.",Kenji Mizoguchi,Kinuyo Tanaka, Yoshiaki Hanayagi, Kyôko Kagawa
Black Friday,2004,8.4,143,22000,Not Rated,76.0,"A film about the investigations following the 1993 serial Bombay bomb blasts, told through the different stories of the people involved --police, conspirators, victims, middlemen.",Anurag Kashyap,Kay Kay Menon, Pawan Malhotra, Aditya Srivastav
Oppenheimer,2023,8.3,180,845000,R,90.0,"A dramatization of the life story of J. Robert Oppenheimer, the physicist who had a large hand in the development of the atomic bombs that brought an end to World War II.",Christopher Nolan,Cillian Murphy, Emily Blunt, Matt Damon
Braveheart,1995,8.3,178,1100000,R,68.0,Scottish warrior William Wallace leads his countrymen in a rebellion to free his homeland from the tyranny of King Edward I of England.,Mel Gibson,Mel Gibson, Sophie Marceau, Patrick McGoohan
Heat,1995,8.3,170,744000,R,76.0,A group of high-end professional thieves start to feel the heat from the LAPD when they unknowingly leave a verbal clue at their latest heist.,Michael Mann,Al Pacino, Robert De Niro, Val Kilmer
Requiem for a Dream,2000,8.3,102,927000,NC-17,71.0,The drug-induced utopias of four Coney Island people are shattered when their addictions run deep.,Darren Aronofsky,Ellen Burstyn, Jared Leto, Jennifer Connelly
Oldboy,2003,8.3,120,666000,R,78.0,"After being kidnapped and imprisoned for fifteen years, Oh Dae-Su is released, only to find that he must track down his captor in five days.",Park Chan-wook,Choi Min-sik, Yoo Ji-tae, Kang Hye-jeong
Good Will Hunting,1997,8.3,126,1100000,R,71.0,"Will Hunting, a janitor at MIT, has a gift for mathematics, but needs help from a psychologist to find direction in his life.",Gus Van Sant,Robin Williams, Matt Damon, Ben Affleck
