Title,Year,Rating,Length (minutes),Rating Amount,Group,Metascore,Short Description,Directors,Star 1,Star 2,Star 3
Winged Migration,2001,7.9,89,12000,G,82.0,"Documentary on the migratory patterns of birds, shot over the course of three years on all seven continents.","Jacques Perrin, Jacques Cluzaud, Michel Debats",Jacques Perrin, Philippe Labro,
Anvil: The Story of Anvil,2008,7.9,80,17000,Not Rated,82.0,"Since 1978, Anvil has become one of heavy metal's most influential yet commercially unsuccessful acts. In 2006, after a fledging European tour Anvil sets out to record their thirteenth album and continue to follow their dreams.",Sacha Gervasi,Robb Reiner, Steve 'Lips' Kudlow, Tiziana Arrigoni
Earth,2007,7.9,90,15000,G,72.0,"Feature-length version of the documentary TV series Planet Earth (2006), following the migration paths of four animal families.","Alastair Fothergill, Mark Linfield",James Earl Jones, Patrick Stewart, Anggun
Anora,2024,7.8,139,71000,R,91.0,"A young escort from Brooklyn meets and impulsively marries the son of a Russian oligarch. Once the news reaches Russia, her fairy tale is threatened as his parents set out for New York to get the marriage annulled.",Sean Baker,Mikey Madison, Paul Weissman, Yura Borisov
Pride & Prejudice,2005,7.8,129,344000,PG,82.0,"Sparks fly when spirited Elizabeth Bennet meets single, rich, and proud Mr. Darcy. But Mr. Darcy reluctantly finds himself falling in love with a woman beneath his class. Can each overcome their own pride and prejudice?",Joe Wright,Keira Knightley, Matthew Macfadyen, Brenda Blethyn
Apocalypto,2006,7.8,139,340000,R,68.0,"As the Mayan kingdom faces its decline, a young man is taken on a perilous journey to a world ruled by fear and oppression.",Mel Gibson,Gerardo Taracena, Raoul Max Trujillo, Dalia Hernández
Poor Things,2023,7.8,141,324000,R,88.0,"An account of the fantastical evolution of Bella Baxter, a young woman brought back to life by the brilliant and unorthodox scientist Dr. Godwin Baxter.",Yorgos Lanthimos,Emma Stone, Mark Ruffalo, Willem Dafoe
The Batman,2022,7.8,176,854000,PG-13,72.0,"When a sadistic serial killer begins murdering key political figures in Gotham, the Batman is forced to investigate the city's hidden corruption and question his family's involvement.",Matt Reeves,Robert Pattinson, Zoë Kravitz, Jeffrey Wright
The Gentlemen,2019,7.8,113,425000,R,51.0,"An American expat tries to sell off his highly profitable marijuana empire in London, triggering plots, schemes, bribery and blackmail in an attempt to steal his domain out from under him.",Guy Ritchie,Matthew McConaughey, Charlie Hunnam, Michelle Dockery
Awakenings,1990,7.8,121,165000,PG-13,74.0,Dr. Sayer is a pioneering neurologist who wants to take a risk and give his patients who suffer from encephalitis a drug used for Parkinson's Disease. He tries it out on one man who miraculously wakes from his perpetual catatonic state.,Penny Marshall,Robert De Niro, Robin Williams, Julie Kavner
Everything Everywhere All at Once,2022,7.8,139,567000,R,81.0,A middle-aged Chinese immigrant is swept up into an insane adventure in which she alone can save existence by exploring other universes and connecting with the lives she could have led.,"Daniel Kwan, Daniel Scheinert",Michelle Yeoh, Stephanie Hsu, Jamie Lee Curtis
Little Women,2019,7.8,135,262000,PG,91.0,"19th century Massachusetts. While the March sisters - Jo, Meg, Amy, and Beth - enter the threshold of womanhood, they go through many ups and downs in life and endeavor to make important decisions that can affect their future.",Greta Gerwig,Saoirse Ronan, Emma Watson, Florence Pugh
The Hateful Eight,2015,7.8,168,682000,R,68.0,"In the dead of a Wyoming winter, a bounty hunter and his prisoner find shelter in a cabin currently inhabited by a collection of nefarious characters.",Quentin Tarantino,Samuel L. Jackson, Kurt Russell, Jennifer Jason Leigh
Call Me by Your Name,2017,7.8,132,333000,R,94.0,"It's the summer of 1983, and 17-year-old Elio is spending the days with his family at their villa in Lombardy, Italy. He soon meets Oliver, who's working as an intern for Elio's father. They discover the heady beauty of awakening desire.",Luca Guadagnino,Timothée Chalamet, Armie Hammer, Michael Stuhlbarg
The Social Network,2010,7.8,120,780000,PG-13,95.0,"As Harvard student Mark Zuckerberg creates the social networking site that would become known as Facebook, he is sued by the twins who claimed he stole their idea and by the co-founder who was later squeezed out of the business.",David Fincher,Jesse Eisenberg, Andrew Garfield, Justin Timberlake
The Notebook,2004,7.8,123,645000,PG-13,53.0,An elderly man reads to a woman with dementia the story of two young lovers whose romance is threatened by the difference in their respective social classes.,Nick Cassavetes,Gena Rowlands, James Garner, Rachel McAdams
The Day of the Jackal,1973,7.8,143,49000,PG,80.0,"In the aftermath of France allowing Algeria's independence, a group of resentful military veterans hire a professional assassin codenamed ""Jackal"" to kill President Charles de Gaulle.",Fred Zinnemann,Edward Fox, Terence Alexander, Michel Auclair
The Hobbit: An Unexpected Journey,2012,7.8,169,895000,PG-13,58.0,"A reluctant Hobbit, Bilbo Baggins, sets out to the Lonely Mountain with a spirited group of dwarves to reclaim their mountain home and the gold within it from the dragon Smaug.",Peter Jackson,Martin Freeman, Ian McKellen, Richard Armitage
Atonement,2007,7.8,123,309000,R,85.0,Thirteen-year-old fledgling writer Briony Tallis irrevocably changes the course of several lives when she accuses her older sister's lover of a crime he did not commit.,Joe Wright,Keira Knightley, James McAvoy, Brenda Blethyn
Rogue One: A Star Wars Story,2016,7.8,133,706000,PG-13,65.0,"In a time of conflict, a group of unlikely heroes band together on a mission to steal the plans to the Death Star, the Empire's ultimate weapon of destruction.",Gareth Edwards,Felicity Jones, Diego Luna, Alan Tudyk
The Big Short,2015,7.8,130,503000,R,81.0,"In 2006-2007 a group of investors bet against the United States mortgage market. In their research, they discover how flawed and corrupt the market is.",Adam McKay,Christian Bale, Steve Carell, Ryan Gosling
I Saw the Devil,2010,7.8,144,153000,Not Rated,67.0,A secret agent exacts revenge on a serial killer through a series of captures and releases.,Kim Jee-woon,Lee Byung-hun, Choi Min-sik, Jeon Gook-hwan
Get Out,2017,7.8,104,745000,R,85.0,"A young African-American visits his white girlfriend's parents for the weekend, where his simmering uneasiness about their reception of him eventually reaches a boiling point.",Jordan Peele,Daniel Kaluuya, Allison Williams, Bradley Whitford
Drive,2011,7.8,100,727000,R,79.0,A mysterious Hollywood action film stuntman gets in trouble with gangsters when he tries to help his neighbor's husband rob a pawn shop while serving as his getaway driver.,Nicolas Winding Refn,Ryan Gosling, Carey Mulligan, Bryan Cranston
The Irishman,2019,7.8,209,447000,R,94.0,"An illustration of Frank Sheeran's life, from W.W.II veteran to hit-man for the Bufalino crime family and his alleged assassination of his close friend Jimmy Hoffa.",Martin Scorsese,Robert De Niro, Al Pacino, Joe Pesci
Tombstone,1993,7.8,130,174000,R,50.0,"A successful lawman's plans to retire anonymously in Tombstone, Arizona, are disrupted by the kind of outlaws he was famous for eliminating.",George P. Cosmatos,Kurt Russell, Val Kilmer, Sam Elliott
About Time,2013,7.8,123,405000,R,55.0,"At the age of 21, Tim discovers he can travel in time and change what happens and has happened in his own life. His decision to make his world a better place by getting a girlfriend turns out not to be as easy as you might think.",Richard Curtis,Domhnall Gleeson, Rachel McAdams, Bill Nighy
Ferris Bueller's Day Off,1986,7.8,103,399000,PG-13,61.0,"A brash, cocky high school senior, tired of skipping school to spend a boring day at home, is determined to enjoy an epic day roaring around his favorite Chicago sites, enlisting his best friend and girlfriend to join him on the adventure.",John Hughes,Matthew Broderick, Alan Ruck, Mia Sara
Past Lives,2023,7.8,105,144000,PG-13,94.0,"Nora and Hae Sung, two deeply connected childhood friends, are wrested apart after Nora's family emigrates from South Korea. Twenty years later, they are reunited for one fateful week as they confront notions of love and destiny.",Celine Song,Greta Lee, Teo Yoo, John Magaro
Dunkirk,2017,7.8,106,764000,PG-13,94.0,"Allied soldiers from Belgium, the British Commonwealth and Empire, and France are surrounded by the German Army and evacuated during a fierce battle in World War II.",Christopher Nolan,Fionn Whitehead, Barry Keoghan, Mark Rylance
The Breakfast Club,1985,7.8,97,451000,R,66.0,Five high school students meet in Saturday detention and discover how they have a great deal more in common than they thought.,John Hughes,Emilio Estevez, Judd Nelson, Molly Ringwald
Society of the Snow,2023,7.8,144,156000,R,72.0,The flight of a rugby team crashes on a glacier in the Andes. The few passengers who survive the crash find themselves in one of the world's toughest environments to survive.,J.A. Bayona,Enzo Vogrincic, Agustín Pardella, Matías Recalt
Star Wars: Episode VII - The Force Awakens,2015,7.8,138,992000,PG-13,80.0,"As a new threat to the galaxy rises, Rey, a desert scavenger, and Finn, an ex-stormtrooper, must join Han Solo and Chewbacca to search for the one hope of restoring peace.",J.J. Abrams,Daisy Ridley, John Boyega, Oscar Isaac
All Quiet on the Western Front,2022,7.8,148,266000,R,76.0,A young German soldier's terrifying experiences and distress on the western front during World War I.,Edward Berger,Felix Kammerer, Albrecht Schuch, Aaron Hilmer
Hidden Figures,2016,7.8,127,269000,PG,74.0,"Three female African-American mathematicians play a pivotal role in astronaut John Glenn's launch into orbit. Meanwhile, they also have to deal with racial and gender discrimination at work.",Theodore Melfi,Taraji P. Henson, Octavia Spencer, Janelle Monáe
Predator,1987,7.8,107,471000,R,47.0,A team of commandos on a mission in a Central American jungle find themselves hunted by an extraterrestrial warrior.,John McTiernan,Arnold Schwarzenegger, Carl Weathers, Kevin Peter Hall
Willy Wonka & the Chocolate Factory,1971,7.8,100,235000,G,67.0,A poor but hopeful boy seeks one of the five coveted golden tickets that will send him on a tour of Willy Wonka's mysterious chocolate factory.,Mel Stuart,Gene Wilder, Jack Albertson, Peter Ostrum
The Curious Case of Benjamin Button,2008,7.8,166,714000,PG-13,70.0,"Benjamin Button, born in 1918 with the physical state of an elderly man, ages in reverse. He experiences love and break-ups, ecstasy and sorrow, and timelessness by the time he dies in 2003 as a baby.",David Fincher,Brad Pitt, Cate Blanchett, Tilda Swinton
Cast Away,2000,7.8,143,658000,PG-13,74.0,A FedEx executive undergoes a physical and emotional transformation after crash landing on a deserted island.,Robert Zemeckis,Tom Hanks, Helen Hunt, Paul Sanchez
Training Day,2001,7.8,122,490000,R,71.0,A rookie cop spends his first day as a Los Angeles narcotics officer with a rogue detective who isn't what he appears to be.,Antoine Fuqua,Denzel Washington, Ethan Hawke, Scott Glenn
Captain America: Civil War,2016,7.8,147,877000,PG-13,75.0,Political involvement in the Avengers' affairs causes a rift between Captain America and Iron Man.,"Anthony Russo, Joe Russo",Chris Evans, Robert Downey Jr., Scarlett Johansson
The Hobbit: The Desolation of Smaug,2013,7.8,161,725000,PG-13,66.0,"The dwarves, along with Bilbo Baggins and Gandalf the Grey, continue their quest to reclaim the Lonely Mountain, their homeland, from the dragon Smaug.",Peter Jackson,Ian McKellen, Martin Freeman, Richard Armitage
The Fall,2006,7.8,117,121000,R,64.0,"In 1920s Los Angeles, a bedridden patient in a hospital captivates a young girl with a fantastic tale of heroes, myths, and villains on a desert island.",Tarsem Singh,Lee Pace, Catinca Untaru, Justine Waddell
Remember the Titans,2000,7.8,113,238000,PG,48.0,"In 1971, Virginia high-school football was everything to the people of Alexandria, but when the school board was forced to integrate an all-Black school with an all-white one, the foundation of football's tradition was put to the test.",Boaz Yakin,Denzel Washington, Will Patton, Wood Harris
Paddington 2,2017,7.8,103,101000,PG,88.0,"Paddington, now happily settled with the Brown family and a popular member of the local community, picks up a series of odd jobs to buy the perfect present for his Aunt Lucy's 100th birthday, only for the gift to be stolen.",Paul King,Ben Whishaw, Hugh Grant, Hugh Bonneville
Ghostbusters,1984,7.8,105,466000,PG,71.0,"Three parapsychologists forced out of their university funding set up shop as a unique ghost removal service in New York City, attracting frightened yet skeptical customers.",Ivan Reitman,Bill Murray, Dan Aykroyd, Sigourney Weaver
The Girl with the Dragon Tattoo,2011,7.8,158,509000,R,71.0,Journalist Mikael Blomkvist is aided in his search for a woman who has been missing for 40 years by hacker Lisbeth Salander.,David Fincher,Daniel Craig, Rooney Mara, Christopher Plummer
Little Miss Sunshine,2006,7.8,101,532000,R,80.0,A family determined to get their young daughter into the finals of a beauty pageant take a cross-country trip in their VW bus.,"Jonathan Dayton, Valerie Faris",Steve Carell, Toni Collette, Greg Kinnear
The Last Samurai,2003,7.8,154,484000,R,55.0,"In 19th century Japan, Nathan Algren, a US army captain, is hired by the Japanese emperor to train his army in the modern warfare techniques. Captain Algren finds himself trapped in a struggle between two eras and two worlds.",Edward Zwick,Tom Cruise, Ken Watanabe, Billy Connolly
Nightcrawler,2014,7.8,117,628000,R,76.0,A petty thief desperate for work muscles into the world of crime journalism and becomes the star of his own story as he blurs the line between observer and participant.,Dan Gilroy,Jake Gyllenhaal, Rene Russo, Bill Paxton
The Bourne Identity,2002,7.8,119,590000,PG-13,68.0,"A man is picked up by a fishing boat, bullet-riddled and suffering from amnesia, before racing to elude assassins and attempting to regain his memory.",Doug Liman,Franka Potente, Matt Damon, Chris Cooper
Puss in Boots: The Last Wish,2022,7.8,102,196000,PG,73.0,"When Puss in Boots discovers that his passion for adventure has taken its toll and he has burned through eight of his nine lives, he launches an epic journey to restore them by finding the mythical Last Wish.","Joel Crawford, Januel Mercado",Antonio Banderas, Salma Hayek, Harvey Guillén
The Untouchables,1987,7.8,119,339000,R,79.0,"During Prohibition, Treasury agent Eliot Ness sets out to stop ruthless Chicago gangster Al Capone, and assembles a small, incorruptible team to help him.",Brian De Palma,Kevin Costner, Sean Connery, Robert De Niro
Manchester by the Sea,2016,7.8,137,327000,R,96.0,A depressed uncle is asked to take care of his teenage nephew after the boy's father dies.,Kenneth Lonergan,Casey Affleck, Michelle Williams, Kyle Chandler
Hot Fuzz,2007,7.8,121,548000,R,81.0,"An overachieving London police sergeant is transferred to a village where the easygoing officers object to his fervor for regulations, all while a string of grisly murders strikes the town.",Edgar Wright,Simon Pegg, Nick Frost, Martin Freeman
A Bronx Tale,1993,7.8,121,169000,R,80.0,"An intense drama about a boy torn between his tough, hard-working father and a violent yet charismatic crime boss.",Robert De Niro,Robert De Niro, Chazz Palminteri, Lillo Brancato
American Gangster,2007,7.8,157,468000,R,76.0,"An outcast New York City cop is charged with bringing down Harlem drug lord Frank Lucas, whose real life inspired this partly biographical film.",Ridley Scott,Denzel Washington, Russell Crowe, Chiwetel Ejiofor
Mary Poppins,1964,7.8,139,191000,G,88.0,"In turn of the century London, a magical nanny employs music and adventure to help two neglected children become closer to their father.",Robert Stevenson,Julie Andrews, Dick Van Dyke, David Tomlinson
Monster,2023,7.8,127,33000,PG-13,79.0,A mother demands answers from her son's teacher when her son begins acting strangely.,Hirokazu Koreeda,Sakura Andô, Eita Nagayama, Soya Kurokawa
Coraline,2009,7.8,100,280000,PG,80.0,"Wandering her rambling old house in her boring new town, a young girl discovers a hidden door to a strangely idealized version of her life that seems too good to be true.",Henry Selick,Dakota Fanning, Teri Hatcher, John Hodgman
Skyfall,2012,7.8,143,745000,PG-13,81.0,"James Bond's loyalty to M is tested when her past comes back to haunt her. When MI6 comes under attack, 007 must track down and destroy the threat, no matter how personal the cost.",Sam Mendes,Daniel Craig, Javier Bardem, Naomie Harris
Captain Fantastic,2016,7.8,118,242000,R,72.0,"In the forests of the Pacific Northwest, a father devoted to raising his six kids with a rigorous physical and intellectual education is forced to leave his paradise and enter the world, challenging his idea of what it means to be a parent.",Matt Ross,Viggo Mortensen, George MacKay, Samantha Isler
RRR,2022,7.8,187,176000,TV-MA,83.0,A fearless warrior on a perilous mission comes face to face with a steely cop serving British forces in this epic saga set in pre-independent India.,S.S. Rajamouli,N.T. Rama Rao Jr., Ram Charan, Ajay Devgn
The Fugitive,1993,7.8,130,329000,PG-13,87.0,"Dr. Richard Kimble, unjustly accused of murdering his wife, must find the real killer while being the target of a nationwide manhunt led by a seasoned U.S. Marshal.",Andrew Davis,Harrison Ford, Tommy Lee Jones, Sela Ward
Misery,1990,7.8,107,246000,R,75.0,"After a famous author is rescued from a car crash by a fan of his novels, he comes to realize that the care he is receiving is only the beginning of a nightmare of captivity and abuse.",Rob Reiner,James Caan, Kathy Bates, Richard Farnsworth
Look Back,2024,7.8,58,12000,13+,90.0,"The overly confident Fujino and the shut-in Kyomoto couldn't be more different, but a love of drawing manga brings these two small-town girls together.",Kiyotaka Oshiyama,Yumi Kawai, Mizuki Yoshida, Yôichirô Saitô
The Sandlot,1993,7.8,101,107000,PG,55.0,"In the summer of 1962, a new kid in town is taken under the wing of a young baseball prodigy and his rowdy team, resulting in many adventures.",David Mickey Evans,Tom Guiry, Mike Vitar, Art LaFleur
Midnight Cowboy,1969,7.8,113,125000,R,79.0,"A naive hustler travels from Texas to New York City to seek personal fortune, finding a new friend in the process.",John Schlesinger,Dustin Hoffman, Jon Voight, Sylvia Miles
Straight Outta Compton,2015,7.8,147,225000,R,72.0,The rap group NWA emerges from the mean streets of Compton in the mid-1980s and revolutionizes hip-hop culture with their music and tales about life in the hood.,F. Gary Gray,O'Shea Jackson Jr., Corey Hawkins, Jason Mitchell
Walk the Line,2005,7.8,136,272000,PG-13,72.0,"A chronicle of country music legend Johnny Cash's life, from his early days on an Arkansas cotton farm to his rise to fame with Sun Records in Memphis, where he recorded alongside Elvis Presley, Jerry Lee Lewis, and Carl Perkins.",James Mangold,Joaquin Phoenix, Reese Witherspoon, Ginnifer Goodwin
Back to the Future Part II,1989,7.8,108,591000,PG,57.0,"After visiting 2015, Marty McFly must repeat his visit to 1955 to prevent disastrous changes to 1985...without interfering with his first trip.",Robert Zemeckis,Michael J. Fox, Christopher Lloyd, Lea Thompson
Big Hero 6,2014,7.8,102,521000,PG,74.0,"A special bond develops between plus-sized inflatable robot Baymax and prodigy Hiro Hamada, who together team up with a group of friends to form a band of high-tech heroes.","Don Hall, Chris Williams",Ryan Potter, Scott Adsit, Jamie Chung
Boyz n the Hood,1991,7.8,112,160000,R,76.0,"Follows the lives of three young males living in the Crenshaw ghetto of Los Angeles, dissecting questions of race, relationships, violence, and future prospects.",John Singleton,Cuba Gooding Jr., Laurence Fishburne, Hudhail Al-Amir
Moonrise Kingdom,2012,7.8,94,372000,PG-13,84.0,"Two 12-year-olds, who live on an island, fall in love with each other and elope into the wilderness. While people set out on a search mission, a violent storm approaching them catches their attention.",Wes Anderson,Jared Gilman, Kara Hayward, Bruce Willis
Mississippi Burning,1988,7.8,128,116000,R,65.0,Two F.B.I. Agents with wildly different styles arrive in Mississippi to investigate the disappearance of some civil rights activists.,Alan Parker,Gene Hackman, Willem Dafoe, Frances McDormand
Serenity,2005,7.8,119,309000,PG-13,74.0,The crew of the ship Serenity try to evade an assassin sent to recapture telepath River.,Joss Whedon,Nathan Fillion, Gina Torres, Chiwetel Ejiofor
Close,2022,7.8,104,41000,PG-13,81.0,"The intense friendship between two thirteen-year old boys Leo and Remi suddenly gets disrupted. Struggling to understand what has happened, Léo approaches Sophie, Rémi's mother. ""Close"" is a film about friendship and responsibility.",Lukas Dhont,Eden Dambrine, Gustav De Waele, Émilie Dequenne
The Insider,1999,7.8,157,185000,R,85.0,A research chemist comes under personal and professional attack when he decides to appear in a 60 Minutes exposé on Big Tobacco.,Michael Mann,Russell Crowe, Al Pacino, Christopher Plummer
Brazil,1985,7.8,132,215000,R,84.0,A bureaucrat in a dystopic society becomes an enemy of the state as he pursues the woman of his dreams.,Terry Gilliam,Jonathan Pryce, Kim Greist, Robert De Niro
Let the Right One In,2008,7.8,114,232000,R,82.0,"Oskar, an overlooked and bullied boy, finds love and revenge through Eli, a beautiful but peculiar girl.",Tomas Alfredson,Kåre Hedebrant, Lina Leandersson, Per Ragnar
The Searchers,1956,7.8,119,99000,Approved,94.0,An American Civil War veteran embarks on a years-long journey to rescue his niece from the Comanches after the rest of his brother's family is massacred in a raid on their Texas farm.,John Ford,John Wayne, Jeffrey Hunter, Vera Miles
Moon,2009,7.8,97,383000,R,67.0,"Astronaut Sam Bell has a quintessentially personal encounter toward the end of his three-year stint on the Moon, where he, working alongside his computer, GERTY, sends back to Earth parcels of a resource that has helped diminish our planet's power problems.",Duncan Jones,Sam Rockwell, Kevin Spacey, Dominique McElligott
Captain Phillips,2013,7.8,134,504000,PG-13,82.0,"The true story of Captain Richard Phillips and the 2009 hijacking by Somali pirates of the U.S.-flagged MV Maersk Alabama, the first American cargo ship to be hijacked in two hundred years.",Paul Greengrass,Tom Hanks, Barkhad Abdi, Barkhad Abdirahman
Kiki's Delivery Service,1989,7.8,103,174000,G,85.0,"Along with her black cat Jiji, Kiki settles in a seaside town and starts a high-flying delivery service. Here begins her magical encounter with independence and responsibility, making lifelong friends and finding her place in the world.",Hayao Miyazaki,Kirsten Dunst, Minami Takayama, Rei Sakuma
Lilya 4-Ever,2002,7.8,109,52000,R,83.0,"Sixteen-year-old Lilja and her only friend, the young boy Volodja, live in Russia, fantasizing about a better life. One day, Lilja falls in love with Andrej, who is going to Sweden, and invites Lilja to come along and start a new life.",Lukas Moodysson,Oksana Akinshina, Artyom Bogucharskiy, Pavel Ponomaryov
The Fighter,2010,7.8,116,396000,R,79.0,"Based on the story of Micky Ward, a fledgling boxer who tries to escape the shadow of his more famous but troubled older boxing brother and get his own shot at greatness.",David O. Russell,Mark Wahlberg, Christian Bale, Amy Adams
The Girl with the Dragon Tattoo,2009,7.8,152,226000,R,76.0,"Influential industrialist Vanger's niece Harriet disappeared under mysterious circumstances 40 years ago. As a last attempt at solving the case, he hires investigative journalist Mikael Blomkvist.",Niels Arden Oplev,Michael Nyqvist, Noomi Rapace, Ewa Fröling
Thirteen Lives,2022,7.8,147,72000,PG-13,66.0,A rescue mission is assembled in Thailand where a group of young boys and their soccer coach are trapped in a system of underground caves that are flooding.,Ron Howard,Viggo Mortensen, Colin Farrell, Joel Edgerton
How to Train Your Dragon 2,2014,7.8,102,376000,PG,77.0,"When Hiccup and Toothless discover an ice cave that is home to hundreds of new wild dragons and the mysterious Dragon Rider, the two friends find themselves at the center of a battle to protect the peace.",Dean DeBlois,Jay Baruchel, Cate Blanchett, Gerard Butler
Kramer vs. Kramer,1979,7.8,105,159000,PG,77.0,"After his wife leaves him, a work-obsessed Manhattan advertising executive is forced to learn long-neglected parenting skills, but a heated custody battle over the couple's young son deepens the wounds left by the separation.",Robert Benton,Dustin Hoffman, Meryl Streep, Jane Alexander
Cabaret,1972,7.8,124,61000,PG,80.0,A female girlie club entertainer in Weimar Republic era Berlin romances two men while the Nazi Party rises to power around them.,Bob Fosse,Liza Minnelli, Michael York, Helmut Griem
Glory,1989,7.8,122,148000,R,78.0,"Robert Gould Shaw leads the U.S. Civil War's first all-black volunteer company, fighting prejudices from both his own Union Army, and the Confederates.",Edward Zwick,Matthew Broderick, Denzel Washington, Cary Elwes
Night of the Living Dead,1968,7.8,96,144000,R,89.0,A ragtag group of Pennsylvanians barricade themselves in an old farmhouse to remain safe from a horde of flesh-eating ghouls that are ravaging the Northeast of the United States.,George A. Romero,Duane Jones, Judith O'Dea, Karl Hardman
