Title,Year,Rating,Length (minutes),Rating Amount,Group,Metascore,Short Description,Directors,Star 1,Star 2,Star 3
Destry Rides Again,1939,7.6,95,13000,Approved,81.0,"Deputy sheriff Destry tames the town of Bottle Neck, including saloon singer Frenchy.",George Marshall,Marlene Dietrich, James Stewart, Mischa Auer
Control,2003,7.6,111,28000,R,72.0,"A tale about a strange young man, Bulcsú, the fellow inspectors on his team, all without exception likable characters, a rival ticket inspection team and racing along the tracks - and a tale about love.",Nimród Antal,Sándor Csányi, Eszter Balla, Zoltán Mucsi
Yankee Doodle Dandy,1942,7.6,126,17000,Approved,89.0,"The life of the renowned musical composer, playwright, actor, dancer, and singer George M. Cohan.",Michael Curtiz,James Cagney, Joan Leslie, Walter Huston
Kedi,2016,7.6,79,16000,Not Rated,78.0,"A profile of an ancient city and its unique people, seen through the eyes of the most mysterious and beloved animal humans have ever known, the Cat.",Ceyda Torun,Yaman Barlas, Sari, Arzu Göl
Jim & Andy: The Great Beyond,2017,7.6,94,28000,TV-MA,77.0,A behind-the-scenes look at how Jim Carrey adopted the persona of idiosyncratic comedian Andy Kaufman on the set of Man on the Moon (1999).,Chris Smith,Jim Carrey, Danny DeVito, Milos Forman
Gun Crazy,1950,7.6,87,16000,Approved,74.0,Two disturbed young people release their fascination with guns through a crime spree.,Joseph H. Lewis,John Dall, Peggy Cummins, Berry Kroeger
Religulous,2008,7.6,101,61000,R,56.0,Bill Maher's take on the current state of world religion.,Larry Charles,Bill Maher, Tal Bachman, Jonathan Boulden
The Fallen Idol,1948,7.6,95,10000,Approved,88.0,"A butler working in a foreign embassy in London falls under suspicion when his wife accidentally falls to her death, the only witness being an impressionable young boy.",Carol Reed,Ralph Richardson, Michèle Morgan, Sonia Dresdel
Eddie Murphy: Raw,1987,7.6,93,21000,R,54.0,Eddie Murphy in a stand-up performance recorded live. For an hour and a half he talks about his favourite subjects: sex and women.,Robert Townsend,Eddie Murphy, Tatyana Ali, Billie Allen
Highway,2014,7.6,133,31000,Not Rated,40.0,"Right before her wedding, a young woman finds herself abducted and held for ransom. As the initial days pass, she begins to develop a strange bond with her kidnapper.",Imtiaz Ali,Alia Bhatt, Randeep Hooda, Durgesh Kumar
Butterfly,1999,7.6,96,10000,R,69.0,"Spain, 1936. Moncho is an outcast at school but is able to form a strong bond with his outspoken teacher. When fascism arrives to Spain, his teacher is considered an enemy of the regime.",José Luis Cuerda,Manuel Lozano, Fernando Fernán Gómez, Uxía Blanco
The Insult,2017,7.6,113,18000,R,72.0,"After an emotional exchange between a Lebanese Christian and a Palestinian refugee escalates, the men end up in a court case that gets national attention.",Ziad Doueiri,Adel Karam, Kamel El Basha, Camille Salameh
It Might Get Loud,2008,7.6,98,14000,PG,70.0,"A documentary on the electric guitar from the point of view of three significant rock musicians: The Edge, Jimmy Page, and Jack White.",Davis Guggenheim,Jimmy Page, The Edge, Jack White
Bob le Flambeur,1956,7.6,102,14000,PG,80.0,"After losing big, an aging gambler decides to assemble a team to rob a casino.",Jean-Pierre Melville,Roger Duchesne, Isabelle Corey, Daniel Cauchy
Athlete A,2020,7.6,103,13000,PG-13,85.0,Follow the Indianapolis Star reporters that broke the story about USA Gymnastics doctor Larry Nassar's abuse and hear from gymnasts like Maggie Nichols.,"Bonni Cohen, Jon Shenk",Maggie Nichols, Gina Nichols, John Nichols
Shooting Dogs,2005,7.6,115,12000,R,71.0,A Catholic Priest and an English teacher get stranded in a school in Kigali during the 1994 Rwandan genocide.,Michael Caton-Jones,John Hurt, Hugh Dancy, Dominique Horwitz
Fireworks Wednesday,2006,7.6,102,14000,Not Rated,84.0,"On the last Wednesday before the spring solstice ushers in the Persian New Year, people set off fireworks following an ancient Zoroastrian tradition. Rouhi, spending her first day at a new job, finds herself in the midst of a different kind of fireworks -- a domestic dispute between her new boss and his wife.",Asghar Farhadi,Hediyeh Tehrani, Taraneh Alidoosti, Hamid Farrokhnezhad
When You're Strange,2009,7.6,86,10000,R,55.0,"A look at the late '60s and early '70s rock band The Doors, including rare exclusive footage.",Tom DiCillo,Johnny Depp, John Densmore, Robby Krieger
I've Loved You So Long,2008,7.6,117,21000,PG-13,79.0,A woman struggles to interact with her family and find her place in society after spending fifteen years in prison.,Philippe Claudel,Kristin Scott Thomas, Elsa Zylberstein, Serge Hazanavicius
Weiner,2016,7.6,96,11000,R,84.0,An examination of disgraced New York Congressman Anthony Weiner's mayoral campaign and today's political landscape.,"Josh Kriegman, Elyse Steinberg",Anthony Weiner, Huma Abedin, Jordan Zain Weiner
Bilal: A New Breed of Hero,2015,7.6,105,19000,PG-13,52.0,"A thousand years ago, one boy with a dream of becoming a great warrior is abducted with his sister and taken to a land far away from home. Thrown into a world where greed and injustice rule all, Bilal finds the courage to raise his voice and make a change. Inspired by true events, this is a story of a real hero who earned his remembrance in time and history.","Khurram H. Alavi, Ayman Jamal",Adewale Akinnuoye-Agbaje, Ian McShane, China Anne McClain
Dogtown and Z-Boys,2001,7.6,91,14000,PG-13,76.0,Documentary about the pioneering 1970s Zephyr skating team.,Stacy Peralta,Sean Penn, Jay Adams, Tony Alva
Side by Side,2012,7.6,99,14000,Not Rated,82.0,"The documentary investigates the history, process and workflow of both digital and photochemical film creation.",Christopher Kenneally,Derek Ambrosi, Michael Ballhaus, Andrzej Bartkowiak
RBG,2018,7.6,98,15000,PG,71.0,"The exceptional life and career of U.S. Supreme Court Justice Ruth Bader Ginsburg, who has developed a breathtaking legal legacy while becoming an unexpected pop culture icon.","Julie Cohen, Betsy West",Ruth Bader Ginsburg, Ann Kittner, Harryette Helsel
Who Killed the Electric Car?,2006,7.6,92,13000,PG,70.0,"A documentary that investigates the birth and death of the electric car, as well as the role of renewable energy and sustainable living in the future.",Chris Paine,Martin Sheen, Tom Hanks, Mel Gibson
Indie Game: The Movie,2012,7.6,103,22000,Not Rated,73.0,"A documentary that follows the journeys of indie game developers as they create games and release those works, and themselves, to the world.","Lisanne Pajot, James Swirsky",Jonathan Blow, Brandon Boyer, Renaud Bédard
The Man Who Copied,2003,7.6,124,12000,R,49.0,A Brazilian photocopier operator falls in love with a girl who lives in an opposite house and spends his evenings looking at her through his binoculars.,Jorge Furtado,Lázaro Ramos, Leandra Leal, Luana Piovani
Spellbound,2002,7.6,97,13000,G,80.0,Spellbound follows eight teenagers on their quest to win the 1999 National Spelling Bee.,Jeffrey Blitz,Angela Arenivar, Ubaldo Arenivar, Jorge Arenivar
Life in a Day,2011,7.6,95,16000,PG-13,58.0,"A documentary shot by film-makers all over the world that serves as a time capsule to show future generations what it was like to be alive on the twenty-fourth of July, 2010.","Tegan Bukowski, Loressa Clisby, Kevin Macdonald",Hiroaki Aikawa, Cindy Baer, Teagan Bentley
"What Happened, Miss Simone?",2015,7.6,101,15000,Not Rated,75.0,"A documentary about the life and legend Nina Simone, an American singer, pianist, and civil rights activist labeled the ""High Priestess of Soul.""",Liz Garbus,Nina Simone, Lisa Simone Kelly, Roger Nupie
Nosferatu,2024,7.5,132,102000,R,78.0,"A gothic tale of obsession between a haunted young woman and the terrifying vampire infatuated with her, causing untold horror in its wake.",Robert Eggers,Lily-Rose Depp, Nicholas Hoult, Bill Skarsgård
Furiosa: A Mad Max Saga,2024,7.5,148,262000,R,79.0,The origin story of renegade warrior Furiosa before her encounter and teamup with Mad Max.,George Miller,Anya Taylor-Joy, Chris Hemsworth, Tom Burke
Eyes Wide Shut,1999,7.5,159,393000,TV-MA,69.0,"A Manhattan doctor embarks on a bizarre, night-long odyssey after his wife's admission of unfulfilled longing.",Stanley Kubrick,Tom Cruise, Nicole Kidman, Todd Field
28 Days Later,2002,7.5,113,467000,R,73.0,"Four weeks after a mysterious, incurable virus spreads throughout the United Kingdom, a handful of survivors try to find sanctuary.",Danny Boyle,Cillian Murphy, Naomie Harris, Christopher Eccleston
The Greatest Showman,2017,7.5,105,326000,PG,48.0,Celebrates the birth of show business and tells of a visionary who rose from nothing to create a spectacle that became a worldwide sensation.,Michael Gracey,Hugh Jackman, Michelle Williams, Zac Efron
Beetlejuice,1988,7.5,92,398000,PG,71.0,"The spirits of a deceased couple are harassed by an unbearable family that has moved into their home, and hire a malicious spirit to drive them out.",Tim Burton,Alec Baldwin, Geena Davis, Michael Keaton
Avatar: The Way of Water,2022,7.5,192,524000,PG-13,67.0,"Jake Sully lives with his newfound family formed on the extrasolar moon Pandora. Once a familiar threat returns to finish what was previously started, Jake must work with Neytiri and the army of the Na'vi race to protect their home.",James Cameron,Sam Worthington, Zoe Saldana, Sigourney Weaver
The Fabelmans,2022,7.5,151,125000,PG-13,85.0,"Growing up in post-World War II era Arizona, young Sammy Fabelman aspires to become a filmmaker as he reaches adolescence, but soon discovers a shattering family secret and explores how the power of films can help him see the truth.",Steven Spielberg,Michelle Williams, Gabriel LaBelle, Paul Dano
Erin Brockovich,2000,7.5,131,230000,R,73.0,A flamboyant law firm secretary works tirelessly to gain justice for a small town wrecked by a utility company's pollution.,Steven Soderbergh,Julia Roberts, Albert Finney, David Brisbin
Harry Potter and the Order of the Phoenix,2007,7.5,138,658000,PG-13,71.0,"With their warning about Lord Voldemort's return scoffed at, Harry and Dumbledore are targeted by the Wizard authorities as an authoritarian bureaucrat slowly seizes power at Hogwarts.",David Yates,Daniel Radcliffe, Emma Watson, Rupert Grint
Baby Driver,2017,7.5,113,639000,R,86.0,"Coerced into working for a crime boss, a young getaway driver must face the music when a doomed heist threatens his life, love, and freedom.",Edgar Wright,Ansel Elgort, Jon Bernthal, Jon Hamm
The Town,2010,7.5,125,427000,R,74.0,A proficient group of thieves rob a bank and hold the manager hostage. Things begin to get complicated when one of the crew members falls in love with her.,Ben Affleck,Ben Affleck, Rebecca Hall, Jon Hamm
A Quiet Place,2018,7.5,90,620000,PG-13,82.0,A family struggles for survival in a world invaded by blind alien creatures with ultra-sensitive hearing.,John Krasinski,Emily Blunt, John Krasinski, Millicent Simmonds
Sleepers,1996,7.5,147,243000,R,49.0,"After a prank goes disastrously wrong, a group of boys are sent to a detention center where they are brutalized. Thirteen years later, an unexpected random encounter with a former guard gives them a chance for revenge.",Barry Levinson,Robert De Niro, Kevin Bacon, Brad Pitt
Les Misérables,2012,7.5,158,352000,PG-13,63.0,"In 19th-century France, Jean Valjean, who, for decades, has been hunted by the ruthless policeman Javert after breaking parole, agrees to care for a factory worker's daughter. The decision changes their lives forever.",Tom Hooper,Hugh Jackman, Russell Crowe, Anne Hathaway
Scott Pilgrim vs. the World,2010,7.5,112,477000,PG-13,69.0,"In a magically realistic version of Toronto, a young man must defeat his new girlfriend's seven evil exes one by one in order to win her heart.",Edgar Wright,Michael Cera, Mary Elizabeth Winstead, Kieran Culkin
A Man Called Otto,2022,7.5,126,186000,PG-13,51.0,"Otto is a grump who's given up on life following the loss of his wife and wants to end it all. When a young family moves in nearby, he meets his match in quick-witted Marisol, leading to a friendship that will turn his world around.",Marc Forster,Tom Hanks, Mariana Treviño, Rachel Keller
Guy Ritchie's the Covenant,2023,7.5,123,183000,R,63.0,"During the war in Afghanistan, a local interpreter risks his own life to carry an injured sergeant across miles of grueling terrain.",Guy Ritchie,Jake Gyllenhaal, Dar Salim, Sean Sagar
Indiana Jones and the Temple of Doom,1984,7.5,118,547000,PG,57.0,"In 1935, Indiana Jones is tasked by Indian villagers with reclaiming a rock stolen from them by a secret cult beneath the catacombs of an ancient palace.",Steven Spielberg,Harrison Ford, Kate Capshaw, Ke Huy Quan
Battle Royale,2000,7.5,114,199000,Not Rated,81.0,"In the future, the Japanese government captures a class of ninth-grade students and forces them to kill one another under the revolutionary ""Battle Royale"" act.",Kinji Fukasaku,Tatsuya Fujiwara, Aki Maeda, Tarô Yamamoto
The Impossible,2012,7.5,114,253000,PG-13,73.0,The story of a tourist family in Thailand caught in the destruction and chaotic aftermath of the 2004 Indian Ocean tsunami.,J.A. Bayona,Naomi Watts, Ewan McGregor, Tom Holland
The Devil's Advocate,1997,7.5,144,417000,R,60.0,An exceptionally adept Florida lawyer is offered a job at a high-end New York City law firm with a high-end boss - the biggest opportunity of his career to date.,Taylor Hackford,Keanu Reeves, Al Pacino, Charlize Theron
Promising Young Woman,2020,7.5,113,221000,R,72.0,"Nothing in Cassie's life is what it appears to be - she's wickedly smart, tantalizingly cunning, and she's living a secret double life. Now, an unexpected encounter is about to give Cassie a chance to right the wrongs from the past.",Emerald Fennell,Carey Mulligan, Bo Burnham, Alison Brie
The Hunger Games: Catching Fire,2013,7.5,146,740000,PG-13,76.0,Katniss Everdeen and Peeta Mellark become targets of the Capitol after their victory in the 74th Hunger Games sparks a rebellion in the Districts of Panem.,Francis Lawrence,Jennifer Lawrence, Josh Hutcherson, Liam Hemsworth
Batman,1989,7.5,126,416000,PG-13,69.0,"The Dark Knight of Gotham City begins his war on crime with his first major enemy being Jack Napier, a criminal who becomes the clownishly homicidal Joker.",Tim Burton,Michael Keaton, Jack Nicholson, Kim Basinger
The Conjuring,2013,7.5,112,577000,R,68.0,Paranormal investigators Ed and Lorraine Warren work to help a family terrorized by a dark presence in their farmhouse.,James Wan,Patrick Wilson, Vera Farmiga, Ron Livingston
Interview with the Vampire,1994,7.5,123,359000,R,62.0,"A vampire tells his epic life story: love, betrayal, loneliness, and hunger.",Neil Jordan,Brad Pitt, Tom Cruise, Antonio Banderas
Total Recall,1990,7.5,113,364000,R,60.0,"When a man goes in to have virtual vacation memories of the planet Mars implanted in his mind, an unexpected and harrowing series of events forces him to go to the planet for real - or is he?",Paul Verhoeven,Arnold Schwarzenegger, Sharon Stone, Michael Ironside
The Piano Teacher,2001,7.5,131,75000,R,79.0,A young man romantically pursues his masochistic piano teacher.,Michael Haneke,Isabelle Huppert, Annie Girardot, Benoît Magimel
Upgrade,2018,7.5,100,218000,R,67.0,"Set in the near-future, technology controls nearly all aspects of life. But when the world of Grey, a self-labeled technophobe, is turned upside down, his only hope for revenge is an experimental computer chip implant.",Leigh Whannell,Logan Marshall-Green, Melanie Vallejo, Steve Danielsen
Jackie Brown,1997,7.5,154,386000,R,62.0,"A flight attendant with a criminal past gets nabbed by the ATF for smuggling. Under pressure to become an informant against the illegal arms dealer she works for, she must find a way to secure her future without getting killed.",Quentin Tarantino,Pam Grier, Samuel L. Jackson, Robert Forster
Trading Places,1983,7.5,116,173000,R,69.0,A snobbish investor and a wily street con artist find their positions reversed as part of a bet by two callous millionaires.,John Landis,Eddie Murphy, Dan Aykroyd, Ralph Bellamy
Contact,1997,7.5,150,301000,PG,62.0,"Dr. Ellie Arroway, after years of searching, finds conclusive radio proof of extraterrestrial intelligence, sending plans for a mysterious machine.",Robert Zemeckis,Jodie Foster, Matthew McConaughey, Tom Skerritt
Fruitvale Station,2013,7.5,85,87000,R,85.0,"The story of Oscar Grant III, a 22-year-old Bay Area resident, who crosses paths with friends, enemies, family, and strangers on the last day of 2008.",Ryan Coogler,Michael B. Jordan, Melonie Diaz, Octavia Spencer
Kill,2023,7.5,105,37000,R,74.0,"During a train trip to New Delhi, a pair of commandos face an army of invading bandits.",Nikhil Nagesh Bhat,Lakshya, Raghav Juyal, Tanya Maniktala
American Fiction,2023,7.5,117,106000,R,81.0,A novelist who's fed up with the establishment profiting from Black entertainment uses a pen name to write a book that propels him into the heart of the hypocrisy and madness he claims to disdain.,Cord Jefferson,Jeffrey Wright, Tracee Ellis Ross, John Ortiz
A Time to Kill,1996,7.5,149,188000,R,53.0,A young Mississippi lawyer defends a black man who killed the two white men that raped his preteen daughter.,Joel Schumacher,Matthew McConaughey, Sandra Bullock, Samuel L. Jackson
One Life,2023,7.5,109,31000,PG,69.0,"Sir Nicholas 'Nicky' Winton, a young London broker who, in the months leading up to World War II, rescued over 600 children from Nazi-occupied Czechoslovakia.",James Hawes,Anthony Hopkins, Lena Olin, Johnny Flynn
Gangs of New York,2002,7.5,167,484000,R,72.0,"In 1862, Amsterdam Vallon returns to the Five Points area of New York City seeking revenge against Bill the Butcher; his father's killer.",Martin Scorsese,Leonardo DiCaprio, Cameron Diaz, Daniel Day-Lewis
Spider-Man 2,2004,7.5,127,735000,PG-13,83.0,Peter Parker is beset with troubles in his failing personal life as he battles a former brilliant scientist named Otto Octavius.,Sam Raimi,Tobey Maguire, Kirsten Dunst, Alfred Molina
The Hurt Locker,2008,7.5,131,481000,R,95.0,"During the Iraq War, a Sergeant recently assigned to an army bomb squad is put at odds with his squad mates due to his maverick way of handling his work.",Kathryn Bigelow,Jeremy Renner, Anthony Mackie, Brian Geraghty
Lone Survivor,2013,7.5,121,313000,R,60.0,"Marcus Luttrell and his team set out on a mission to capture or kill notorious Taliban leader Ahmad Shah, in late June 2005. Marcus and his team are left to fight for their lives in one of the most valiant efforts of modern warfare.",Peter Berg,Mark Wahlberg, Taylor Kitsch, Emile Hirsch
The Warriors,1979,7.5,93,114000,R,65.0,A street gang known as the Warriors must fight its way from the Bronx to its home turf on Coney Island when its members are falsely accused of assassinating a respected gang leader.,Walter Hill,Michael Beck, James Remar, Dorsey Wright
The Crow,1994,7.5,102,219000,R,72.0,"The night before his wedding, musician Eric Draven and his fiancée are brutally murdered by members of a violent gang. On the anniversary of their death, Eric rises from the grave and assumes the mantle of the Crow, a supernatural avenger.",Alex Proyas,Brandon Lee, Michael Wincott, Rochelle Davis
Little Children,2006,7.5,137,119000,R,75.0,"The lives of two lovelorn spouses from separate marriages, a registered sex offender, and a disgraced ex-police officer intersect as they struggle to resist their vulnerabilities and temptations in suburban Massachusetts.",Todd Field,Kate Winslet, Jennifer Connelly, Patrick Wilson
Wallace & Gromit: The Curse of the Were-Rabbit,2005,7.5,85,151000,G,87.0,"Wallace and his loyal dog, Gromit, set out to discover the mystery behind the garden sabotage that plagues their village and threatens the annual giant vegetable growing contest.","Steve Box, Nick Park",Peter Sallis, Helena Bonham Carter, Ralph Fiennes
Legends of the Fall,1994,7.5,133,189000,R,45.0,"In the early 1900s, three brothers and their father living in the remote wilderness of Montana are affected by betrayal, history, love, nature, and war.",Edward Zwick,Brad Pitt, Anthony Hopkins, Aidan Quinn
The Favourite,2018,7.5,119,245000,R,91.0,"In early 18th-century England, the status quo at the court is upset when a new servant arrives and endears herself to a frail Queen Anne.",Yorgos Lanthimos,Olivia Colman, Emma Stone, Rachel Weisz
Zombieland,2009,7.5,88,639000,R,73.0,"A shy student trying to reach his family in Ohio, a gun-toting bruiser in search of the last Twinkie and a pair of sisters striving to get to an amusement park join forces in a trek across a zombie-filled America.",Ruben Fleischer,Jesse Eisenberg, Emma Stone, Woody Harrelson
"I, Tonya",2017,7.5,119,250000,R,77.0,"Competitive ice skater Tonya Harding rises amongst the ranks at the U.S. Figure Skating Championships, but her future in the activity is thrown into doubt when her ex-husband intervenes.",Craig Gillespie,Margot Robbie, Sebastian Stan, Allison Janney
Ice Age,2002,7.5,81,537000,PG,61.0,"Manny the mammoth, Sid the loquacious sloth, and Diego the sabre-toothed tiger go on a comical quest to return a human baby back to his father, across a world on the brink of an ice age.","Chris Wedge, Carlos Saldanha",Denis Leary, John Leguizamo, Ray Romano
Doctor Strange,2016,7.5,115,832000,PG-13,72.0,"While on a journey of physical and spiritual healing, a brilliant neurosurgeon is drawn into the world of the mystic arts.",Scott Derrickson,Benedict Cumberbatch, Chiwetel Ejiofor, Rachel McAdams
The Abyss,1989,7.5,140,199000,PG-13,62.0,A civilian diving team is enlisted to search for a lost nuclear submarine and faces danger while encountering an alien aquatic species.,James Cameron,Ed Harris, Mary Elizabeth Mastrantonio, Michael Biehn
An American Werewolf in London,1981,7.5,97,127000,R,55.0,"American college students David Kessler and Jack Goodman on a walking tour of Britain are attacked by a werewolf that none of the locals will admit exists. Jack dies. David recovers in a hospital, where he has nightmares.",John Landis,David Naughton, Jenny Agutter, Joe Belcher
127 Hours,2010,7.5,94,411000,R,82.0,"A mountain climber becomes trapped under a boulder while canyoneering alone near Moab, Utah and resorts to desperate measures in order to survive.",Danny Boyle,James Franco, Amber Tamblyn, Kate Mara
Collateral,2004,7.5,120,444000,R,71.0,A cab driver finds himself the hostage of an engaging contract killer as he makes his rounds from hit to hit during one night in Los Angeles.,Michael Mann,Tom Cruise, Jamie Foxx, Jada Pinkett Smith
The Hunt for Red October,1990,7.5,135,221000,PG,58.0,"In November 1984, the Soviet Union's best submarine captain violates orders and heads for the U.S. in a new undetectable sub. The American CIA and military must quickly determine: Is he trying to defect or to start a war?",John McTiernan,Sean Connery, Alec Baldwin, Scott Glenn
National Lampoon's Christmas Vacation,1989,7.5,97,234000,PG-13,49.0,The Griswold family's plans for a big family Christmas predictably turn into a big disaster.,Jeremiah S. Chechik,Chevy Chase, Beverly D'Angelo, Juliette Lewis
The Aviator,2004,7.5,170,392000,PG-13,77.0,A biopic depicting the early years of legendary director and aviator Howard Hughes' career from the late 1920s to the mid 1940s.,Martin Scorsese,Leonardo DiCaprio, Cate Blanchett, Kate Beckinsale
Young Woman and the Sea,2024,7.5,129,15000,PG,62.0,"The story of competitive swimmer Gertrude Ederle, who, in 1926, was the first woman to ever swim across the English Channel.",Joachim Rønning,Daisy Ridley, Tilda Cobham-Hervey, Stephen Graham
The Last Temptation of Christ,1988,7.5,164,65000,R,80.0,"The life of Jesus Christ, his journey through life as he faces the struggles all humans do, and his final temptation on the cross.",Martin Scorsese,Willem Dafoe, Harvey Keitel, Barbara Hershey
Master and Commander: The Far Side of the World,2003,7.5,138,244000,PG-13,81.0,"During the Napoleonic Wars, a brash British captain pushes his ship and crew to their limits in pursuit of a formidable French war vessel around South America.",Peter Weir,Russell Crowe, Paul Bettany, Billy Boyd
Munich,2005,7.5,164,245000,R,74.0,"After the Black September capture and massacre of Israeli athletes at the 1972 Olympics, five men are chosen to eliminate the people responsible for that fateful day.",Steven Spielberg,Eric Bana, Daniel Craig, Marie-Josée Croze
It's a Mad Mad Mad Mad World,1963,7.5,210,48000,Approved,59.0,"A group of motorists witnesses a car crash in the California desert, and after the driver's dying words indicate the location of a hidden stash of loot, they turn against each other in a race across the state to get to it.",Stanley Kramer,Spencer Tracy, Milton Berle, Ethel Merman
Lolita,1962,7.5,153,111000,Approved,79.0,A middle-aged college professor becomes infatuated with a 14-year-old girl.,Stanley Kubrick,James Mason, Shelley Winters, Sue Lyon
Leaving Las Vegas,1995,7.5,111,139000,R,82.0,"Ben Sanderson, a Hollywood screenwriter who lost everything because of his alcoholism, arrives in Las Vegas to drink himself to death. There, he meets and forms an uneasy friendship and non-interference pact with prostitute Sera.",Mike Figgis,Nicolas Cage, Elisabeth Shue, Julian Sands
Incredibles 2,2018,7.5,118,346000,PG,80.0,The Incredibles family takes on a new mission which involves a change in family roles: Bob Parr (Mr. Incredible) must manage the house while his wife Helen (Elastigirl) goes out to save the world.,Brad Bird,Craig T. Nelson, Holly Hunter, Sarah Vowell
Perfume: The Story of a Murderer,2006,7.5,147,271000,R,56.0,"Jean-Baptiste Grenouille, born with a superior olfactory sense, creates the world's finest perfume. His work, however, takes a dark turn as he searches for the ultimate scent.",Tom Tykwer,Ben Whishaw, Dustin Hoffman, Alan Rickman
