No.,Title,Year,Rating,Duration (minutes),Rating Amount,Group,Short Description,Directors,Stars
95,Eternal Sunshine of the Spotless Mind,2004,8.3,108,1100000,R,"When their relationship turns sour, a couple undergoes a medical procedure to have each other erased from their memories forever.",Michel Gondry,"Jim Carrey, Kate Winslet, Tom Wilkinson"
96,Ikiru,1952,8.3,143,94000,Approved,A bureaucrat tries to find meaning in his life after he discovers he has terminal cancer.,Akira Kurosawa,"Takashi Shimura, Nobuo Kaneko, Shin'ichi Himori"
97,2001: A Space Odyssey,1968,8.3,149,744000,PG,"When a mysterious artifact is uncovered on the Moon, a spacecraft manned by two humans and one supercomputer is sent to Jupiter to find its origins.",Stanley Kubrick,"Keir Dullea, Gary Lockwood, William Sylvester"
98,Reservoir Dogs,1992,8.3,99,1100000,R,"When a simple jewelry heist goes horribly wrong, the surviving criminals begin to suspect that one of them is a police informant.",Quentin Tarantino,"Harvey Keitel, Tim Roth, Michael Madsen"
99,The Apartment,1960,8.3,125,205000,R,"A Manhattan insurance clerk tries to rise in his company by letting its executives use his apartment for trysts, but office politics and his own romantic hopes complicate matters.",Billy Wilder,"Jack Lemmon, Shirley MacLaine, Fred MacMurray"
100,Lawrence of Arabia,1962,8.3,227,325000,Approved,"The story of T.E. Lawrence, the English officer who successfully united and led the diverse, often warring, Arab tribes during World War I in order to fight the Turks.",David Lean,"Peter O'Toole, Alec Guinness, Anthony Quinn"
101,Incendies,2010,8.3,131,220000,Approved,Twins journey to the Middle East to discover their family history and fulfill their mother's last wishes.,Denis Villeneuve,"Lubna Azabal, Mélissa Désormeaux-Poulin, Maxim Gaudette"
102,Scarface,1983,8.3,170,949000,PG,"In the 1980s, a determined criminal-minded Cuban immigrant becomes the biggest drug smuggler in Miami, and is eventually undone by his own drug addiction.",Brian De Palma,"Al Pacino, Michelle Pfeiffer, Steven Bauer"
103,Double Indemnity,1944,8.3,107,173000,R,"An insurance representative is seduced by a dissatisfied housewife into a scheme of insurance fraud and murder that arouses the suspicion of his colleague, a claims investigator.",Billy Wilder,"Fred MacMurray, Barbara Stanwyck, Edward G. Robinson"
104,North by Northwest,1959,8.3,136,357000,Passed,"A New York City advertising executive goes on the run after being mistaken for a government agent by a group of foreign spies, and falls for a woman whose loyalties he begins to doubt.",Alfred Hitchcock,"Cary Grant, Eva Marie Saint, James Mason"
105,Citizen Kane,1941,8.3,119,477000,R,"Following the death of publishing tycoon Charles Foster Kane, reporters scramble to uncover the meaning of his final utterance: 'Rosebud.'",Orson Welles,"Orson Welles, Joseph Cotten, Dorothy Comingore"
106,Heat,1995,8.3,170,744000,PG,A group of high-end professional thieves start to feel the heat from the LAPD when they unknowingly leave a verbal clue at their latest heist.,Michael Mann,"Al Pacino, Robert De Niro, Val Kilmer"
107,M,1931,8.3,99,175000,PG,"When the police in a German city are unable to catch a child-murderer, other criminals join in the manhunt.",Fritz Lang,"Peter Lorre, Ellen Widmann, Inge Landgut"
108,Full Metal Jacket,1987,8.2,116,812000,R,A pragmatic U.S. Marine observes the dehumanizing effects the Vietnam War has on his fellow recruits from their brutal boot camp training to the bloody street fighting in Hue.,Stanley Kubrick,"Matthew Modine, R. Lee Ermey, Vincent D'Onofrio"
109,Up,2009,8.3,96,1200000,R,"78-year-old Carl Fredricksen travels to South America in his house equipped with balloons, inadvertently taking a young stowaway.","Pete Docter, Bob Peterson","Edward Asner, Jordan Nagai, John Ratzenberger"
110,Vertigo,1958,8.3,128,440000,R,"A former San Francisco police detective juggles wrestling with his personal demons and becoming obsessed with the hauntingly beautiful woman he has been hired to trail, who may be deeply disturbed.",Alfred Hitchcock,"James Stewart, Kim Novak, Barbara Bel Geddes"
111,Amélie,2001,8.3,122,811000,Approved,"Despite being caught in her imaginative world, young waitress Amelie decides to help people find happiness. Her quest to spread joy leads her on a journey during which she finds true love.",Jean-Pierre Jeunet,"Audrey Tautou, Mathieu Kassovitz, Rufus"
112,Oppenheimer,2023,8.3,180,843000,PG-13,"A dramatization of the life story of J. Robert Oppenheimer, the physicist who had a large hand in the development of the atomic bombs that brought an end to World War II.",Christopher Nolan,"Cillian Murphy, Emily Blunt, Matt Damon"
113,A Clockwork Orange,1971,8.2,136,902000,R,Alex DeLarge and his droogs barbarize a decaying near-future.,Stanley Kubrick,"Malcolm McDowell, Patrick Magee, Michael Bates"
114,To Kill a Mockingbird,1962,8.3,129,340000,PG,A widowed lawyer in Depression-era Alabama defends a black man against a false rape charge while teaching his young children about the sad reality of prejudice.,Robert Mulligan,"Gregory Peck, John Megna, Frank Overton"
115,A Separation,2011,8.3,118,266000,PG,A married couple are faced with a difficult decision - to improve the life of their child by moving to another country or to stay in Iran and look after a deteriorating parent who has Alzheimer's disease.,Asghar Farhadi,"Payman Maadi, Leila Hatami, Sareh Bayat"
116,Die Hard,1988,8.2,132,980000,PG-13,A New York City police officer tries to save his estranged wife and several others taken hostage by terrorists during a Christmas party at the Nakatomi Plaza in Los Angeles.,John McTiernan,"Bruce Willis, Alan Rickman, Bonnie Bedelia"
117,The Sting,1973,8.3,129,287000,Not Rated,Two grifters team up to pull off the ultimate con.,George Roy Hill,"Paul Newman, Robert Redford, Robert Shaw"
118,Like Stars on Earth,2007,8.3,162,214000,R,A young boy is thought to be nothing but a lazy troublemaker until the new art teacher has the patience and compassion to discover the real problem behind his struggles in school.,"Aamir Khan, Amole Gupte","Darsheel Safary, Aamir Khan, Tisca Chopra"
119,Indiana Jones and the Last Crusade,1989,8.2,127,830000,R,"In 1938, after his father goes missing while pursuing the Holy Grail, Indiana Jones finds himself up against the Nazis again to stop them from obtaining its powers.",Steven Spielberg,"Harrison Ford, Sean Connery, Alison Doody"
120,Metropolis,1927,8.3,153,192000,R,"In a futuristic city sharply divided between the working class and the city planners, the son of the city's mastermind falls in love with a working-class prophet who predicts the coming of a savior to mediate their differences.",Fritz Lang,"Brigitte Helm, Alfred Abel, Gustav Fröhlich"
121,Snatch,2000,8.2,102,935000,Not Rated,"Unscrupulous boxing promoters, violent bookmakers, a Russian gangster, incompetent amateur robbers and supposedly Jewish jewelers fight to track down a priceless stolen diamond.",Guy Ritchie,"Jason Statham, Brad Pitt, Stephen Graham"
122,1917,2019,8.2,119,713000,R,"April 6th, 1917. As an infantry battalion assembles to wage war deep in enemy territory, two soldiers are assigned to race against time and deliver a message that will stop 1,600 men from walking straight into a deadly trap.",Sam Mendes,"Dean-Charles Chapman, George MacKay, Daniel Mays"
123,L.A. Confidential,1997,8.2,138,635000,Not Rated,"As corruption grows in 1950s Los Angeles, three policemen - one strait-laced, one brutal, and one sleazy - investigate a series of murders with their own brand of justice.",Curtis Hanson,"Kevin Spacey, Russell Crowe, Guy Pearce"
124,Bicycle Thieves,1948,8.3,89,182000,R,"In post-war Italy, a working-class man's bicycle is stolen, endangering his efforts to find work. He and his son set out to find it.",Vittorio De Sica,"Lamberto Maggiorani, Enzo Staiola, Lianella Carell"
125,Downfall,2004,8.2,156,384000,PG-13,"Traudl Junge, the final secretary for Adolf Hitler, tells of the Nazi dictator's final days in his Berlin bunker at the end of WWII.",Oliver Hirschbiegel,"Bruno Ganz, Alexandra Maria Lara, Ulrich Matthes"
126,Dangal,2016,8.3,161,221000,R,"Mahavir Singh Phogat, a former wrestler, decides to fulfill his dream of winning a gold medal for his country by training his daughters for the Commonwealth Games despite the existing social stigmas.",Nitesh Tiwari,"Aamir Khan, Sakshi Tanwar, Fatima Sana Shaikh"
127,Taxi Driver,1976,8.2,114,961000,PG-13,"A mentally unstable veteran works as a nighttime taxi driver in New York City, where the perceived decadence and sleaze fuels his urge for violent action.",Martin Scorsese,"Robert De Niro, Jodie Foster, Cybill Shepherd"
128,Hamilton,2020,8.3,160,124000,R,"The real life of one of America's foremost founding fathers and first Secretary of the Treasury, Alexander Hamilton. Captured live on Broadway from the Richard Rodgers Theater with the original Broadway cast.",Thomas Kail,"Lin-Manuel Miranda, Phillipa Soo, Leslie Odom Jr."
129,The Wolf of Wall Street,2013,8.2,180,1700000,PG-13,"Based on the true story of Jordan Belfort, from his rise to a wealthy stock-broker living the high life to his fall involving crime, corruption and the federal government.",Martin Scorsese,"Leonardo DiCaprio, Jonah Hill, Margot Robbie"
130,Batman Begins,2005,8.2,140,1600000,Approved,"After witnessing his parents' death, Bruce learns the art of fighting to confront injustice. When he returns to Gotham as Batman, he must stop a secret society that intends to destroy the city.",Christopher Nolan,"Christian Bale, Michael Caine, Ken Watanabe"
131,For a Few Dollars More,1965,8.2,132,284000,PG,Two bounty killers with similar intentions but different motivations team up to track down a psychotic Mexican outlaw before he and his gang can carry out an audacious bank robbery.,Sergio Leone,"Clint Eastwood, Lee Van Cleef, Gian Maria Volontè"
132,Green Book,2018,8.2,130,617000,Approved,A working-class Italian-American bouncer becomes the driver for an African-American classical pianist on a tour of venues through the 1960s American South.,Peter Farrelly,"Viggo Mortensen, Mahershala Ali, Linda Cardellini"
133,Some Like It Hot,1959,8.2,121,291000,Passed,"After two male musicians witness a mob hit, they flee the state in an all-female band disguised as women, but further complications set in.",Billy Wilder,"Marilyn Monroe, Tony Curtis, Jack Lemmon"
134,The Truman Show,1998,8.2,103,1300000,PG-13,An insurance salesman begins to suspect that his whole life is actually some sort of reality TV show.,Peter Weir,"Jim Carrey, Ed Harris, Laura Linney"
135,Judgment at Nuremberg,1961,8.3,179,89000,R,"Fictionalized depiction of the 1947 Judges' Trial, the third of twelve trials of Nazi war criminals conducted by the American occupying forces in Nuremberg, Germany, in which former judges of Nazi Germany were tried for their actions.",Stanley Kramer,"Spencer Tracy, Burt Lancaster, Richard Widmark"
136,The Kid,1921,8.2,68,139000,Approved,"The Tramp cares for an abandoned child, but events put their relationship in jeopardy.",Charles Chaplin,"Charles Chaplin, Edna Purviance, Jackie Coogan"
137,The Father,2020,8.2,97,207000,R,"A man refuses all assistance from his daughter as he ages. As he tries to make sense of his changing circumstances, he begins to doubt his loved ones, his own mind and even the fabric of his reality.",Florian Zeller,"Anthony Hopkins, Olivia Colman, Mark Gatiss"
138,Shutter Island,2010,8.2,138,1500000,PG-13,Two US marshals are sent to a mental institution on an inhospitable island in order to investigate the disappearance of a patient.,Martin Scorsese,"Leonardo DiCaprio, Emily Mortimer, Mark Ruffalo"
139,All About Eve,1950,8.2,138,143000,R,A seemingly timid but secretly ruthless ingénue insinuates herself into the lives of an aging Broadway star and her circle of theater friends.,Joseph L. Mankiewicz,"Bette Davis, Anne Baxter, George Sanders"
140,There Will Be Blood,2007,8.2,158,661000,PG-13,"A story of family, religion, hatred, oil and madness, focusing on a turn-of-the-century prospector in the early days of the business.",Paul Thomas Anderson,"Daniel Day-Lewis, Paul Dano, Ciarán Hinds"
141,Jurassic Park,1993,8.2,127,1100000,R,"An industrialist invites some experts to visit his theme park of cloned dinosaurs. After a power failure, the creatures run loose, putting everyone's lives, including his grandchildren's, in danger.",Steven Spielberg,"Sam Neill, Laura Dern, Jeff Goldblum"
142,Casino,1995,8.2,178,583000,PG-13,"In Las Vegas, two best friends--a casino executive and a Mafia enforcer--compete for a gambling empire and a fast-living, fast-loving socialite.",Martin Scorsese,"Robert De Niro, Sharon Stone, Joe Pesci"
143,The Sixth Sense,1999,8.2,107,1100000,R,"After being shot by a resentful former patient whom he failed to help, a Philadelphia child psychologist seeks redemption by treating a young boy with a disturbing secret.",M. Night Shyamalan,"Bruce Willis, Haley Joel Osment, Toni Collette"
144,Ran,1985,8.2,160,141000,R,"In Medieval Japan, an elderly warlord retires, handing over his empire to his three sons. However, he vastly underestimates how the new-found power will corrupt them and cause them to turn on each other...and him.",Akira Kurosawa,"Tatsuya Nakadai, Akira Terao, Jinpachi Nezu"
145,Top Gun: Maverick,2022,8.2,130,753000,R,"The story involves Maverick confronting his past while training a group of younger Top Gun graduates, including the son of his deceased best friend, for a dangerous mission.",Joseph Kosinski,"Tom Cruise, Jennifer Connelly, Miles Teller"
146,No Country for Old Men,2007,8.2,122,1100000,R,Violence and mayhem ensue after a hunter stumbles upon the aftermath of a drug deal gone wrong and over two million dollars in cash near the Rio Grande.,"Ethan Coen, Joel Coen","Tommy Lee Jones, Javier Bardem, Josh Brolin"
147,Pan's Labyrinth,2006,8.2,118,718000,PG-13,"In 1944 Spain, a girl is sent to live with her ruthless stepfather. During the night, she meets a fairy who takes her to an old faun. He tells her she's a princess, but must prove her royalty by surviving three gruesome tasks.",Guillermo del Toro,"Ivana Baquero, Ariadna Gil, Sergi López"
148,The Thing,1982,8.2,109,489000,R,A research team in Antarctica is hunted by a shape-shifting alien that assumes the appearance of its victims.,John Carpenter,"Kurt Russell, Wilford Brimley, Keith David"
149,Unforgiven,1992,8.2,130,448000,Approved,Retired Old West gunslinger Will Munny reluctantly takes on one last job to avenge an injustice with the help of his old partner and a newer outlaw known simply as The Schofield Kid.,Clint Eastwood,"Clint Eastwood, Gene Hackman, Morgan Freeman"
150,A Beautiful Mind,2001,8.2,135,1000000,Not Rated,"A mathematical genius, John Nash made an astonishing discovery early in his career and stood on the brink of international acclaim. But the handsome and arrogant Nash soon found himself on a harrowing journey of self-discovery.",Ron Howard,"Russell Crowe, Ed Harris, Jennifer Connelly"
151,Kill Bill: Vol. 1,2003,8.2,111,1200000,R,"After waking from a four-year coma, a former assassin wreaks vengeance on the team of assassins who betrayed her.",Quentin Tarantino,"Uma Thurman, David Carradine, Daryl Hannah"
152,The Treasure of the Sierra Madre,1948,8.2,126,136000,G,Two down-on-their-luck Americans searching for work in 1920s Mexico convince an old prospector to help them mine for gold in the Sierra Madre Mountains.,John Huston,"Humphrey Bogart, Walter Huston, Tim Holt"
153,Yojimbo,1961,8.2,110,136000,Approved,A crafty ronin comes to a town divided by two criminal gangs and decides to play them against each other to free the town.,Akira Kurosawa,"Toshirô Mifune, Eijirô Tôno, Tatsuya Nakadai"
154,Prisoners,2013,8.2,153,852000,PG,"Keller Dover is facing every parent's worst nightmare. His six-year-old daughter, Anna, is missing, together with her friend, Joy, and as minutes turn to hours, panic sets in. The only lead is an RV that had been parked on their street.",Denis Villeneuve,"Hugh Jackman, Jake Gyllenhaal, Viola Davis"
155,Finding Nemo,2003,8.2,100,1100000,PG,"After his son is captured in the Great Barrier Reef and taken to Sydney, a timid clownfish sets out on a journey to bring him home.","Andrew Stanton, Lee Unkrich","Albert Brooks, Ellen DeGeneres, Alexander Gould"
156,The Great Escape,1963,8.2,172,265000,PG,"Allied officers in a German prisoner of war camp during World War II making a daring plan for a mass escape by hundreds of their men, hoping to draw German personnel and resources away from combat operations.",John Sturges,"Steve McQueen, James Garner, Richard Attenborough"
157,Monty Python and the Holy Grail,1975,8.2,91,582000,PG,"King Arthur and his Knights of the Round Table embark on a surreal, low-budget search for the Holy Grail, encountering many, very silly obstacles.","Terry Gilliam, Terry Jones","Graham Chapman, John Cleese, Eric Idle"
158,Howl's Moving Castle,2004,8.2,119,473000,PG,"When an unconfident young woman is cursed with an old body by a spiteful witch, her only chance of breaking the spell lies with a self-indulgent yet insecure young wizard and his companions in his legged, walking castle.",Hayao Miyazaki,"Chieko Baishô, Takuya Kimura, Tatsuya Gashûin"
159,The Wild Robot,2024,8.2,102,118000,Not Rated,"After a shipwreck, an intelligent robot called Roz is stranded on an uninhabited island. To survive the harsh environment, Roz bonds with the island's animals and cares for an orphaned baby goose.",Chris Sanders,"Lupita Nyong'o, Pedro Pascal, Kit Connor"
160,The Elephant Man,1980,8.2,124,268000,G,"A Victorian surgeon rescues a heavily disfigured man who is mistreated while scraping a living as a side-show freak. Behind his monstrous façade, there is revealed a person of kindness, intelligence and sophistication.",David Lynch,"Anthony Hopkins, John Hurt, Anne Bancroft"
161,Dial M for Murder,1954,8.2,105,195000,R,A former tennis star arranges the murder of his adulterous wife.,Alfred Hitchcock,"Ray Milland, Grace Kelly, Robert Cummings"
162,Rashomon,1950,8.2,88,187000,R,"The rape of a bride and the murder of her samurai husband are recalled from the perspectives of a bandit, the bride, the samurai's ghost and a woodcutter.",Akira Kurosawa,"Toshirô Mifune, Machiko Kyô, Masayuki Mori"
163,Gone with the Wind,1939,8.2,238,343000,R,A sheltered and manipulative Southern belle and a roguish profiteer face off in a turbulent romance as the society around them crumbles with the end of slavery and is rebuilt during the Civil War and Reconstruction periods.,Victor Fleming,"Clark Gable, Vivien Leigh, Thomas Mitchell"
164,Chinatown,1974,8.1,130,361000,PG,"A private detective hired to expose an adulterer in 1930s Los Angeles finds himself caught up in a web of deceit, corruption, and murder.",Roman Polanski,"Jack Nicholson, Faye Dunaway, John Huston"
165,The Secret in Their Eyes,2009,8.2,129,230000,PG,A retired legal counselor writes a novel hoping to find closure for one of his past unresolved homicide cases and for his unreciprocated love with his superior - both of which still haunt him decades later.,Juan José Campanella,"Ricardo Darín, Soledad Villamil, Pablo Rago"
166,"Lock, Stock and Two Smoking Barrels",1998,8.1,107,630000,R,"When four small-time criminals lose a rigged poker game against a London kingpin, he gives them one week to settle their enormous debt.",Guy Ritchie,"Jason Flemyng, Dexter Fletcher, Nick Moran"
167,Klaus,2019,8.2,96,209000,R,"A simple act of kindness always sparks another, even in a frozen, faraway place. When Smeerensburg's new postman, Jesper, befriends toymaker Klaus, their gifts melt an age-old feud and deliver a sleigh full of holiday traditions.","Sergio Pablos, Carlos Martínez López","Jason Schwartzman, J.K. Simmons, Rashida Jones"
168,Inside Out,2015,8.1,95,851000,R,"After young Riley is uprooted from her Midwest life and moved to San Francisco, her emotions - Joy, Fear, Anger, Disgust and Sadness - conflict on how best to navigate a new city, house, and school.","Pete Docter, Ronnie Del Carmen","Amy Poehler, Bill Hader, Lewis Black"
169,V for Vendetta,2005,8.1,132,1200000,PG,"In a future British dystopian society, a shadowy freedom fighter, known only by the alias of ""V"", plots to overthrow the tyrannical government - with the help of a young woman.",James McTeigue,"Hugo Weaving, Natalie Portman, Rupert Graves"
170,"Three Billboards Outside Ebbing, Missouri",2017,8.1,115,573000,R,A mother personally challenges the local authorities to solve her daughter's murder when they fail to catch the culprit.,Martin McDonagh,"Frances McDormand, Woody Harrelson, Sam Rockwell"
171,Raging Bull,1980,8.1,129,391000,PG-13,"The life of boxer Jake LaMotta, whose violence and temper that led him to the top in the ring destroyed his life outside of it.",Martin Scorsese,"Robert De Niro, Cathy Moriarty, Joe Pesci"
172,The Bridge on the River Kwai,1957,8.1,161,239000,R,"British POWs are forced to build a railway bridge across the river Kwai for their Japanese captors in occupied Burma, not knowing that the allied forces are planning a daring commando raid through the jungle to destroy it.",David Lean,"William Holden, Alec Guinness, Jack Hawkins"
173,Trainspotting,1996,8.1,93,743000,PG-13,"Renton, deeply immersed in the Edinburgh drug scene, tries to clean up and get out despite the allure of drugs and the influence of friends.",Danny Boyle,"Ewan McGregor, Ewen Bremner, Jonny Lee Miller"
174,Catch Me If You Can,2002,8.1,141,1100000,PG-13,"Barely 17 yet, Frank is a skilled forger who has passed as a doctor, lawyer and pilot. FBI agent Carl becomes obsessed with tracking down the con man, who only revels in the pursuit.",Steven Spielberg,"Leonardo DiCaprio, Tom Hanks, Christopher Walken"
175,Fargo,1996,8.1,98,745000,R,Minnesota car salesman Jerry Lundegaard's inept crime falls apart due to his and his henchmen's bungling and the persistent police work of the quite pregnant Marge Gunderson.,"Joel Coen, Ethan Coen","William H. Macy, Frances McDormand, Steve Buscemi"
176,Warrior,2011,8.1,140,509000,PG-13,"The youngest son of an alcoholic former boxer returns home, where he's trained by his father for competition in a mixed martial arts tournament - a path that puts the fighter on a collision course with his estranged, older brother.",Gavin O'Connor,"Tom Hardy, Nick Nolte, Joel Edgerton"
177,Harry Potter and the Deathly Hallows: Part 2,2011,8.1,130,983000,PG-13,"As the battle between the forces of good and evil in the wizarding world escalates, Harry Potter draws ever closer to his final confrontation with Voldemort.",David Yates,"Daniel Radcliffe, Emma Watson, Rupert Grint"
178,Gran Torino,2008,8.1,116,832000,G,"After a Hmong teenager tries to steal his prized 1972 Gran Torino, a disgruntled, prejudiced Korean War veteran seeks to redeem both the boy and himself.",Clint Eastwood,"Clint Eastwood, Bee Vang, Christopher Carley"
179,Spider-Man: No Way Home,2021,8.2,148,929000,R,"With Spider-Man's identity now revealed, Peter asks Doctor Strange for help. When a spell goes wrong, dangerous foes from other worlds start to appear.",Jon Watts,"Tom Holland, Zendaya, Benedict Cumberbatch"
180,Million Dollar Baby,2004,8.1,132,739000,G,"Frankie, an ill-tempered old coach, reluctantly agrees to train aspiring boxer Maggie. Impressed with her determination and talent, he helps her become the best and the two soon form a close bond.",Clint Eastwood,"Hilary Swank, Clint Eastwood, Morgan Freeman"
181,My Neighbor Totoro,1988,8.1,86,399000,PG,"When two girls move to the country to be near their ailing mother, they have adventures with the wondrous forest spirits who live nearby.",Hayao Miyazaki,"Hitoshi Takagi, Noriko Hidaka, Chika Sakamoto"
182,Mad Max: Fury Road,2015,8.1,120,1100000,PG,"In a post-apocalyptic wasteland, a woman rebels against a tyrannical ruler in search for her homeland with the aid of a group of female prisoners, a psychotic worshipper and a drifter named Max.",George Miller,"Tom Hardy, Charlize Theron, Nicholas Hoult"
183,Ben-Hur,1959,8.1,212,260000,R,"A Jewish prince is betrayed and sent into slavery by a Roman friend in 1st-century Jerusalem, but it's not long before he regains his freedom and comes back for revenge.",William Wyler,"Charlton Heston, Jack Hawkins, Stephen Boyd"
184,Children of Heaven,1997,8.2,89,84000,R,"After a boy loses his sister's pair of shoes, he goes on a series of adventures in order to find them. When he can't, he tries a new way to ""win"" a new pair.",Majid Majidi,"Reza Naji, Amir Farrokh Hashemian, Bahare Seddiqi"
185,Barry Lyndon,1975,8.1,185,190000,R,An Irish rogue wins the heart of a rich widow and assumes her dead husband's aristocratic position in 18th-century England.,Stanley Kubrick,"Ryan O'Neal, Marisa Berenson, Patrick Magee"
186,12 Years a Slave,2013,8.1,134,757000,R,"In the antebellum United States, Solomon Northup, a free black man from upstate New York, is abducted and sold into slavery.",Steve McQueen,"Chiwetel Ejiofor, Michael Kenneth Williams, Michael Fassbender"
187,Before Sunrise,1995,8.1,101,353000,R,"A young man and woman meet on a train in Europe, and wind up spending one evening together in Vienna. Unfortunately, both know that this will probably be their only night together.",Richard Linklater,"Ethan Hawke, Julie Delpy, Andrea Eckert"
188,Blade Runner,1982,8.1,117,845000,PG,A blade runner must pursue and terminate four replicants who stole a ship in space and have returned to Earth to find their creator.,Ridley Scott,"Harrison Ford, Rutger Hauer, Sean Young"
189,The Grand Budapest Hotel,2014,8.1,99,914000,R,"A writer encounters the owner of an aging high-class hotel, who tells him of his early years serving as a lobby boy in the hotel's glorious years under an exceptional concierge.",Wes Anderson,"Ralph Fiennes, F. Murray Abraham, Mathieu Amalric"
